cluster,cluster_keyword
1273,"수급권자, 급여, 시장·군수·구청장, 통지"
1274,"안전점검, 정밀안전진단, 시설물, 관리주체"
699,"범죄피해자, 경찰, 성폭력피해자, 종사자"
727,"소방자동차, 소방활동, 소방공무원, 119"
82,"기상업무, 기상청장, 기상정보, 기상재해"
743,"수자원, 지하수, 관리, 계획"
48,"운송사업자, 운수종사자, 여객자동차, 영상기록장치"
1276,"재활용, 폐기물, 재활용의무생산자, 부담금"
1275,"자동차, 대체부품, 부품, 인증"
1277,"문화예술, 성범죄, 장려금, 제재"
312,"철도차량, 안전, 국토교통부장관, 철도운영자"
578,"공중위생영업, 과징금, 면허, 행정제재"
1279,"농어업인, 농어촌, 지방자치단체, 해양수산부장관"
801,"수산직접지불금, 어업인, 도서지역, 조건불리지역"
1278,"어린이집, 보육교사, 보육, 직장어린이집"
1280,"뇌물, 처벌, 외국공무원, 제3자"
1113,"태권도, 진흥, 문화체육관광부장관, 진흥기본계획"
1282,"장애인, 체육시설, 운동선수, 신고"
1283,"이러닝산업, 이러닝사업자, 계약, 불공정"
1281,"화장품, 어린이, 안전성, 표시·광고"
871,"소음대책지역, 주민지원사업, 공항소음, 공항계정"
545,"건설안전, 건설사업관리, 국토안전관리원, 안전관리계획"
1284,"연안, 바닷가, 공유수면, 관리"
325,"식품위생교육, 영업자, 행정처분, 동업자조합"
4,"중소기업, 지원, 창업자, 제조업"
1285,"소방공무원, 소방복합치유센터, 건강관리, 의료기관"
1286,"환경친화적 자동차, 수소연료공급시설, 충전시설, 과태료"
1287,"사업주, 근로자, 임금, 건강장해"
562,"해양심층수, 해양심층수처리수, 신고, 허가"
327,"일본식 한자어, 한글화, 법률 용어, 쉬운 우리말"
408,"문화재, 지정문화재, 허가, 신고"
735,"전통시장, 상인회, 시장관리자, 안전"
1289,"약사, 약사면허, 약사국가시험, 외국"
1288,"해양산업클러스터, 개발계획, 입주기업, 수용"
1290,"전기통신금융사기, 사기이용계좌, 피해구제, 피해금"
1291,"벌금형, 징역형, 법정형, 부정행위"
110,"산림, 임산물, 국유림, 목재"
964,"아동·청소년, 성매매, 피해, 성범죄"
277,"국가보훈처장, 지원, 정보, 법률"
546,"첨단의료복합단지, 의료연구개발, 첨단의료산업진흥재단, 의료연구개발기관"
1292,"재생에너지, 전기사업, 재생에너지전기공급사업, 전력구매계약 PPA"
1293,"평생교육, 평생교육기관, 평생교육사, 자격증"
846,"제품안전, 안전관리, 구매대행업자, 병행수입업자"
139,"상속세, 증여세, 공제, 과세"
1266,"관광산업, 국제회의, 기본계획, 법률"
1037,"다문화가족, 교육, 결혼이민자, 학교"
590,"자격증, 벌칙, 행정처분, 대여"
356,"허가, 신고, 인증, 제도"
356,"허가, 신고, 인증, 제도"
876,"지방세, 감면, 취득세, 재산세"
814,"공정거래위원회, 지주회사, 기업집단, 상호출자제한기업집단"
969,"한글화, 법률용어, 일본식 용어, 한자어"
1294,"전통시장, 상인연합회, 온누리상품권, 중소벤처기업부장관"
515,"지방세, 체납, 공매, 납부"
1295,"한한령, 콘텐츠, 문화산업, 중국"
1296,"대학교육기관, 학교법인, 적립금, 계약제 교원"
1297,"통일주체국민회의, 폐지, 헌법, 법률"
139,"상속세, 증여세, 공제, 과세"
1298,"초지, 허가, 국유지, 공유지"
1299,"법원, 설치, 관할, 지원"
460,"산후조리원, 산모, 신생아, 난임"
110,"산림, 임산물, 국유림, 목재"
86,"상표, 출원, 등록, 전문기관"
1300,"전기사업, 전력시장, 등록, 전기자동차충전사업"
1301,"수도권정비계획, 총량규제, 수도권정비위원회, 인구집중유발시설"
986,"선박, 위험물, 벌금, 음주운항"
1302,"전수교육, 전수교육조교, 전승교수, 국가무형문화재"
1304,"청원, 심사, 국회, 위원회"
1303,"전파, 무선국, 인가, 전자파"
1298,"초지, 허가, 국유지, 공유지"
211,"법률용어, 일본식 용어, 한글화, 이해"
725,"소방시설업, 소방기술자, 방염처리업, 과태료"
1306,"가축사육업, 축산업, 허가, 축사"
1305,"혈액원, 혈액, 헌혈, 보건복지부장관"
139,"상속세, 증여세, 공제, 과세"
1307,"과태료, 벌칙, 처벌, 형평성"
1308,"포항지진, 피해구제, 진상조사, 지원금"
99,"폐기물, 수출입, 환경부장관, 처리"
846,"제품안전, 안전관리, 구매대행업자, 병행수입업자"
94,"벌금형, 법정형, 징역, 국민권익위원회"
698,"상임위원회, 본회의, 법률, 청원"
558,"과태료, 행정질서벌, 형평성, 처벌"
1239,"양성평등, 여성, 임금, 공공기관"
1310,"국가연구개발사업, 연구개발, 과학기술기본법, 제재"
748,"형사소송법, 약식명령, 정식재판, 불이익변경금지"
1309,"고용평등, 차별, 근로자, 육아휴직"
1053,"토지수용위원회, 사업인정, 공익사업, 보상"
1311,"사회서비스, 제공자, 자료, 과태료"
750,"산림복지, 과태료, 산림청장, 한국산림복지진흥원"
846,"제품안전, 안전관리, 구매대행업자, 병행수입업자"
731,"물류단지, 스마트물류센터, 인증, 물류시설"
1312,"거래정보, 금융회사, 제공, 금융위원회"
416,"사업시행자, 지역개발, 개발계획, 지정"
10,"농림축산식품부장관, 산업, 지원, 육성"
278,"선행기술조사, 전문기관, 특허출원, 특허청장"
1023,"행정중심복합도시, 건설청장, 세종특별자치시, 건축허가"
110,"산림, 임산물, 국유림, 목재"
1313,"조직은행, 조직, 인체조직, 식품의약품안전처장"
1314,"초지, 조례, 농림축산식품부령, 시장·군수·구청장"
427,"개인정보, 가명정보, 개인정보 보호위원회, 정보통신망 이용촉진 및 정보보호 등에 관한 법률"
1315,"변리사, 벌금, 위원회, 형법"
1317,"국가과학기술자문회의, 과학기술정책, 국가연구개발사업, 예산"
51,"보행우선구역, 지정, 교통약자, 보행권"
1316,"공유수면, 점용료, 사용료, 과태료"
441,"철도시설, 철도건설사업, 국토교통부장관, 철도국유재산"
211,"법률용어, 일본식 용어, 한글화, 이해"
1318,"문화예술, 문학관, 한국문화예술위원회, 문화시설"
1319,"화물낙하, 교통사고, 업무상과실치상죄, 중과실치상죄"
900,"간행물, 출판사, 유통, 신고"
964,"아동·청소년, 성매매, 피해, 성범죄"
1320,"국가표준, 출연금, 기관, 법률"
326,"여객자동차 운수사업, 운수종사자, 전액관리제, 사납금제"
534,"살생물제, 생활화학제품, 안전관리, 승인"
1322,"보상금, 신청, 기간, 특수임무수행자"
1321,"의료급여, 수급권자, 부당이득, 급여비용"
1129,"주민등록, 거주불명, 시장·군수 또는 구청장, 제도 개선"
1193,"축산, 계열화사업자, 사육, 가축"
7,"가축, 축산물, 이력관리, 가금"
1323,"농어업재해보험, 농업정책보험금융원, 보험료율, 재해보험사업"
591,"보건복지부장관, 수련병원, 전공의, 지도전문의"
916,"법률, 한자어, 한글화, 법치주의"
933,"장애인연금, 기초급여액, 장애인, 인상"
1324,"계약, 이의신청, 계약상대자, 낙찰자"
1335,"과태료, 한국해양소년단연맹, 상한액, 조정"
1325,"가습기 살균제, 4·16세월호참사, 특별조사위원회, 진상규명"
1326,"휴면예금, 서민금융진흥원, 서민금융, 출연"
99,"폐기물, 수출입, 환경부장관, 처리"
1327,"행정중심복합도시, 건설청장, 국토교통부장관, 개발계획"
1328,"항만, 허가, 항만배후단지, 기업"
292,"악취, 악취관리지역, 악취배출시설, 배출허용기준"
374,"세무사, 자격, 압류, 공매"
251,"수입식품, 해외제조업소, 식품의약품안전처장, 현지실사"
1329,"도시철도운송사업, 신고, 수리, 법령"
1331,"청소년정책위원회, 청소년, 위원, 민간위원"
1330,"건설사업관리, 사후평가, 국토교통부장관, 실적"
269,"과징금, 금융지주회사, 과태료, 부과한도"
198,"산업재해, 근로자, 안전, 보건"
1332,"댐 주변지역, 친환경 활용, 자연환경 보전, 지속가능발전"
944,"소프트웨어, 소프트웨어산업, 소프트웨어사업, 진흥"
671,"고독사, 고독사 예방, 실태조사, 지원"
1333,"헌법재판소, 재판관, 임용, 결격사유"
1334,"자연환경보전, 도시생태, 무인도서, 과태료"
270,"금융투자업자, 약관, 사후보고, 사전신고"
1336,"식습관, 어린이·청소년, 과일·채소, 국내 농산물"
286,"항공기, 안전, 국토교통부장관, 초경량비행장치"
1337,"국제금융기구, 출자, 출연, 가입"
511,"아동학대, 취업제한, 아동관련기관, 피해아동"
1338,"전자장치, 부착기간, 출국허가, 미귀국"
1028,"식생활교육, 기본계획, 지정기준, 지정취소"
1114,"무역보험, 무역보험계약체결한도, 한국무역보험공사, 정부"
542,"개발제한구역, 허가, 신고, 훼손지정비사업"
1340,"장애예술인, 문화예술 활동, 지원, 국가와 지방자치단체"
1339,"마약류, 마약류취급정보, 오남용, 마약류통합정보관리센터"
1341,"식품의약품안전처장, 제재처분, 과징금, 임상시험"
1342,"환경영향평가, 사업자, 협의, 환경부장관"
1072,"산업기술, 국가핵심기술, 유출, 침해행위"
15,"벌금형, 범죄, 적용 대상, 형벌"
1343,"공공재정, 부정청구, 환수, 제재부가금"
122,"민간임대주택, 임대사업자, 임차인, 등록임대주택"
1344,"여성농어업인, 모성권, 건강검진, 지원"
82,"기상업무, 기상청장, 기상정보, 기상재해"
1346,"도로, 구조·시설 기준, 주민, 보행자"
1345,"어린이통학버스, 운전자, 안전, 하차확인"
1347,"외국인환자, 유치기관, 인증, 등록"
252,"식품안전, 식품, 소비자, 식품의약품안전처장"
1348,"마리나항만, 마리나항만시설, 마리나선박, 레저선박"
738,"물환경, 비점오염, 폐수처리, 수경시설"
174,"법률, 제명, 개정, 혼란"
1349,"보좌직원, 국회의원, 직권면직, 비서"
1350,"회생법원, 회생사건, 파산사건, 개인회생사건"
505,"건축사, 건축물, 업무, 대가"
1351,"특별관리임산물, 산촌진흥기본계획, 시행계획, 산림청장"
1041,"선거, 후보자, 선거운동, 여론조사"
1352,"병역사항, 공직자, 신고, 공개"
636,"해양수산부장관, 해양치유, 해양치유자원, 선원"
1354,"경제자유구역, 항만법, 실시계획, 의제"
1353,"노외주차장, 주차장, 비용, 도시미관"
196,"근로자, 연차휴가, 임금, 도급"
1355,"가격, 세액, 환급, 납세의무자"
277,"국가보훈처장, 지원, 정보, 법률"
1357,"기계설비, 기계설비유지관리자, 기계설비성능점검업자, 국토교통부"
979,"중독예방치유부담금, 사행산업통합감독위원회, 국민체육진흥기금, 사행산업"
1356,"발명교육, 창의력, 산업재산권, 지원"
498,"법률안, 안, 제, 소위원회"
740,"댐, 수질, 물관리, 용수공급"
862,"청소년, 청소년쉼터, 청소년지도사, 여성가족부"
312,"철도차량, 안전, 국토교통부장관, 철도운영자"
112,"저작권, 저작권법, 일부개정법률안, 문화체육관광위원회"
711,"도로, 도로관리청, 교통, 복구비용"
1358,"기술, 사업화, 공공기술, 허가"
33,"장애인연금, 중증장애인, 장애등급, 장애정도"
252,"식품안전, 식품, 소비자, 식품의약품안전처장"
416,"사업시행자, 지역개발, 개발계획, 지정"
1359,"어린이집, 평가, 한국보육진흥원, 보육"
643,"대체복무, 복무기간, 병역, 편입"
429,"보험회사, 보험계약자, 손해사정, 과태료"
545,"건설안전, 건설사업관리, 국토안전관리원, 안전관리계획"
634,"개인회생절차, 변제기간, 변제계획, 개정법"
544,"관세사, 징계, 결격사유, 직무"
1361,"헌혈, 헌혈증서, 혈액, 보건복지부장관"
1360,"해양안전심판, 심판변론인, 해양사고관련자, 심판"
288,"표시등, 표지, 국토교통부장관, 시정명령"
862,"청소년, 청소년쉼터, 청소년지도사, 여성가족부"
1362,"점자, 시각장애인, 교과용 도서, 교원"
132,"학교용지, 학교용지부담금, 개발사업, 교육감"
1363,"공공기관, 대통령령, 임원, 법률"
1365,"공공임대주택, 임차권, 입주자격, 전대"
782,"총포, 허가, 제조, 처벌"
1364,"과태료, 상한액, 명칭, 사용"
302,"선박, 해양오염, 연료유, 방제"
351,"청소년, 청소년유해약물등, 청소년보호, 출입금지"
1366,"해양수산과학기술, 계획, 해양수산부장관, 지정"
1367,"농촌융복합산업, 농촌융복합시설, 사업자, 시설"
1368,"항만공사, 사용료, 징수, 시장ㆍ군수ㆍ구청장"
1151,"보조금, 보조금통합관리망, 보조사업, 보조사업자"
1328,"항만, 허가, 항만배후단지, 기업"
1369,"역세권개발, 역세권, 철도시설, 개발이익"
543,"해양안전, 항로표지, 전문인력, 해양교통"
1251,"항공, 비행훈련, 교육생, 과태료"
277,"국가보훈처장, 지원, 정보, 법률"
1370,"벌금, 개정, 화재예방, 소방시설"
1373,"식품산업, 푸드테크, 지원, 육성"
512,"아동, 양육비, 지원, 소득"
1371,"인쇄사, 폐업신고, 폐업, 신고"
1374,"식량, 농업, 자급, 정책"
1372,"법률용어, 법 문장, 국민, 이해"
680,"법률용어, 한자어, 일본식, 한글화"
327,"일본식 한자어, 한글화, 법률 용어, 쉬운 우리말"
1251,"항공, 비행훈련, 교육생, 과태료"
1375,"건설기술, 국토교통부장관, 신기술, 발주청"
1376,"교원, 평의원회, 정관, 재임용"
148,"부동산투자회사, 주식, 공시, 주주총회"
1024,"궤도시설, 안전, 궤도사업자, 궤도운송"
277,"국가보훈처장, 지원, 정보, 법률"
769,"지역사랑상품권, 지방자치단체, 지역경제, 활성화"
1377,"농어업인, 지원, 농어촌상생협력기금, 농어업법인"
130,"국제개발협력, 한국국제협력단, 주관기관, 시행기관"
770,"농어촌민박, 농업생산기반시설, 농어촌정비사업, 마을정비구역"
990,"지방문화원, 지역문화, 지역문화사업, 지방문화분권"
286,"항공기, 안전, 국토교통부장관, 초경량비행장치"
1378,"벌금형, 과태료, 질서위반행위, 삭제"
38,"응급의료, 응급환자, 구급차, 자동심장충격기"
1379,"한국인원자폭탄피해자지원위원회, 위원, 공무원, 벌칙"
1380,"동력수상레저기구, 조종면허, 결격사유, 정신질환자"
1381,"한국원자력의학원, 부설기관, 설치, 정관"
312,"철도차량, 안전, 국토교통부장관, 철도운영자"
550,"어촌, 어항, 허가, 공단"
1382,"대구경북과학기술원, 부설기관, 정관, 설치"
1383,"바둑, 진흥, 문화체육관광부장관, 지원"
1384,"기반시설, 관리주체, 민간관리자, 성능개선"
1385,"정부납부기술료, 과학기술진흥기금, 국가재정법, 기술료"
683,"법률용어, 일본식 용어, 전자문서, 개정"
339,"화학물질, 유해성평가, 척추동물시험, 등록"
1386,"특허, 프로그램, 실시, 법률"
498,"법률안, 안, 제, 소위원회"
1387,"교원, 대학, 겸직, 보고"
110,"산림, 임산물, 국유림, 목재"
110,"산림, 임산물, 국유림, 목재"
1388,"진상규명, 위원회, 조사, 피해자"
1334,"자연환경보전, 도시생태, 무인도서, 과태료"
110,"산림, 임산물, 국유림, 목재"
1389,"금연구역, 국민건강증진부담금, 궐련형 전자담배, 어린이집"
1390,"공무원연금, 퇴직연금, 분할연금, 급여"
1391,"국어, 국어책임관, 발전, 보전"
1392,"공공기관, 임원, 채용비리, 경영공시"
463,"과징금, 과태료, 위반행위, 현행법"
254,"건강기능식품, 기준, 규격, 표시·광고"
1393,"목재제품, 규격·품질검사, 산림청장, 검사기관"
346,"건설기술, 건설기술인, 품질검사, 용어"
1394,"교원, 임용, 폐지, 사범대학"
1395,"해외농업자원개발, 해외산림자원개발, 사업계획, 신고"
825,"기상청장, 질병관리청장, 검정, 정보"
1396,"보호대상아동, 임대주택, 주거지원, 주거기본권"
713,"민자도로, 통행료, 유료도로관리청, 민자도로사업자"
88,"영업비밀, 침해행위, 손해배상, 벌칙"
131,"회계법인, 공인회계사, 감사, 분할"
886,"국가균형발전, 혁신도시, 시·도, 지역발전"
1397,"농림식품과학기술, 수산, 연구ㆍ개발, 법률"
712,"운전면허, 교통안전, 자동차, 교통사고"
1398,"약사, 면허, 보건복지부장관, 의약품"
511,"아동학대, 취업제한, 아동관련기관, 피해아동"
1399,"농지보전부담금, 농지관리기금, 농어촌구조개선 특별회계, 농지"
918,"·27법난피해자명예회복심의위원회, 공무원, 심의·의결, 법 문장"
301,"건강보험료, 보험료, 지역가입자, 직장가입자"
139,"상속세, 증여세, 공제, 과세"
450,"국민연금, 연금보험료, 수급권, 반환일시금"
1400,"피한정후견인, 결격사유, 행위능력, 성년후견"
1401,"소음대책지역, 소음피해, 군용비행장, 국방부장관"
463,"과징금, 과태료, 위반행위, 현행법"
1402,"재난지역, 특별재생지역, 도시재생, 재난피해"
122,"민간임대주택, 임대사업자, 임차인, 등록임대주택"
100,"공공폐자원관리시설, 폐기물, 주민, 설치"
1404,"사이버 성범죄, 촬영물, 처벌, 법정형"
1403,"응급구조사, 자격증, 벌칙, 행정처분"
1405,"지원, 대상지역, 송전선로, 중복"
122,"민간임대주택, 임대사업자, 임차인, 등록임대주택"
1406,"액화석유가스, 한국석유관리원, 벌금형, 산업통상자원부장관"
1407,"공인노무사, 징계, 직무, 등록"
1408,"참조표준, 법률, 시행령, 정부"
33,"장애인연금, 중증장애인, 장애등급, 장애정도"
1409,"보호구역, 군사시설, 관할부대장, 협의"
347,"전기공사업, 등록, 공사업자, 처벌"
460,"산후조리원, 산모, 신생아, 난임"
1410,"액화석유가스, 안전관리, 배관망공급사업, 허가"
1411,"수산물, 유통, 지정, 지원"
1412,"동물실험시설, 동물실험, 과징금, 운영자"
88,"영업비밀, 침해행위, 손해배상, 벌칙"
1293,"평생교육, 평생교육기관, 평생교육사, 자격증"
1316,"공유수면, 점용료, 사용료, 과태료"
277,"국가보훈처장, 지원, 정보, 법률"
1413,"연명의료계획서, 연명의료, 말기환자, 환자"
1414,"화장품, 식품의약품안전처장, 소비자, 인증"
4,"중소기업, 지원, 창업자, 제조업"
606,"군인, 주거지원, 퇴직급여금, 현행법"
1261,"개발행위, 도시·군계획사업, 개발사업, 예정지역"
397,"농지, 농업인, 노후생활안정자금, 자조금단체"
1415,"·18민주화운동, 진상규명조사위원회, 진상규명, 위원회"
262,"분양, 광고, 건축물, 내진설계"
1416,"마약류, 마약, 청소년, 처벌"
159,"장기요양기관, 수급자, 공단, 장기요양급여"
416,"사업시행자, 지역개발, 개발계획, 지정"
1418,"무형문화재, 위원회, 전승, 보전"
1417,"원료물질, 가공제품, 안전관리, 제조"
1419,"산림교육, 산림교육전문가, 유아숲체험원, 인증"
783,"해양생태계, 해양생물, 보호대상해양생물, 해양생태계보전협력금"
158,"노인학대, 노인, 벌칙, 전용쉼터"
82,"기상업무, 기상청장, 기상정보, 기상재해"
1420,"해수욕장, 시설, 관리청, 과태료"
139,"상속세, 증여세, 공제, 과세"
1213,"방송사업자, 방송영상물, 방송, 소비자"
283,"정신질환자, 정신건강복지센터, 정신요양시설, 과징금"
1421,"사립학교교직원 연금법, 공중보건의사, 교직원 재직기간, 병역복무기간"
933,"장애인연금, 기초급여액, 장애인, 인상"
1422,"국유재산, 특례, 무상, 대부"
277,"국가보훈처장, 지원, 정보, 법률"
605,"연금, 급여, 군인, 지급"
1423,"대학도서관, 종합계획, 시행계획, 진흥"
1086,"화물자동차, 운수종사자, 유가보조금, 종사자격"
737,"특정수질유해물질, 상수원관리지역, 가산금, 잠실수중보"
1424,"피후견인, 결격사유, 성년후견, 행위능력"
745,"수도용 자재 및 제품, 인증, 수거등의 명령, 검사"
1425,"미혼모, 건강관리, 지원, 의료비"
1427,"위험물, 운반, 차량, 운전자"
1426,"도시숲, 조성, 관리, 지방자치단체"
1428,"예비군, 훈련, 미세먼지, 병역법"
127,"한국지방재정공제회, 지방자치단체, 사업, 공제"
268,"금융서비스, 금융규제, 금융위원회, 혁신금융서비스"
730,"물류산업, 물류기업, 국제물류, 물류공동화"
1429,"통신사실 확인자료, 통신제한조치, 정보주체, 헌법재판소"
1422,"국유재산, 특례, 무상, 대부"
1316,"공유수면, 점용료, 사용료, 과태료"
1430,"폐교재산, 귀농어·귀촌, 지원시설, 수의계약"
1431,"의료 해외진출, 신고, 신고수리, 공항시설법"
341,"환승센터, 교통, 계획, 빅데이터"
1432,"환경범죄, 과징금, 환경감시관, 불법배출"
464,"과징금, 과태료, 시정조치, 위반행위"
1433,"방과후학교, 초등학교, 일몰기한, 영어"
277,"국가보훈처장, 지원, 정보, 법률"
211,"법률용어, 일본식 용어, 한글화, 이해"
1434,"인력개발원, 교육훈련, 사업, 보건복지"
359,"수산식품산업, 육성, 지원, 해양수산부장관"
506,"공공건축, 건축기획, 건축자산, 건축법"
282,"자살예방, 자살시도자, 자살자 가족, 심리적 지원"
1435,"집합건물, 관리인, 구분소유자, 공용부분"
1437,"전통시장, 시설현대화사업, 지원, 활성화"
827,"도시농업, 도시, 재배, 행위"
558,"과태료, 행정질서벌, 형평성, 처벌"
194,"항만재개발사업, 항만구역, 해양수산부장관, 주변지역"
1193,"축산, 계열화사업자, 사육, 가축"
1291,"벌금형, 징역형, 법정형, 부정행위"
481,"공익신고자, 보호조치, 공익신고, 구조금"
1436,"대륙붕, 배타적 경제수역, 해양법에 관한 국제연합 협약, 주권적 권리"
100,"공공폐자원관리시설, 폐기물, 주민, 설치"
1438,"농어업, 농어업인, 농특위원회, 여성농어업인"
1409,"보호구역, 군사시설, 관할부대장, 협의"
110,"산림, 임산물, 국유림, 목재"
37,"장애인, 인증, 보건복지부장관, 시설"
42,"지방자치법, 교육위원회, 지역 개발, 법률"
54,"교육훈련, 학습근로자, 기업, 고용노동부장관"
1439,"생태계교란 생물, 생태계위해우려 생물, 위해성평가, 유입주의 생물"
427,"개인정보, 가명정보, 개인정보 보호위원회, 정보통신망 이용촉진 및 정보보호 등에 관한 법률"
254,"건강기능식품, 기준, 규격, 표시·광고"
253,"표시·광고, 식품, 식품의약품안전처장, 부당한 표시·광고"
174,"법률, 제명, 개정, 혼란"
347,"전기공사업, 등록, 공사업자, 처벌"
1440,"최저임금, 산입범위, 임금, 취업규칙"
1441,"해상여객운송사업, 내항화물운송사업, 운송계약, 면허"
1443,"장애인, 의료비, 모성보호, 모·부성권 보장"
1442,"국민건강증진, 금연, 신체활동, 과태료"
1173,"관세, 납세자, 세관장, 조사"
636,"해양수산부장관, 해양치유, 해양치유자원, 선원"
716,"교원, 정관, 평의원회, 법률"
1444,"북한이탈주민, 정착지원, 보호, 지원"
87,"디자인, 디자인등록출원, 신규성, 보호"
1445,"한자어, 한글화, 개정, 표현"
4,"중소기업, 지원, 창업자, 제조업"
94,"벌금형, 법정형, 징역, 국민권익위원회"
348,"건설업자, 건설사업자, 건설업, 종사자"
1446,"도서관법, 사서, 자격, 장애인"
211,"법률용어, 일본식 용어, 한글화, 이해"
1447,"문화예술교육사, 자격, 결격사유, 문화예술교육 지원법"
44,"시·도지사, 기초지방자치단체, 특별자치시, 예방교육"
668,"임업, 특별관리임산물, 산촌, 임업진흥권역"
1448,"무역조정지원, 기업, 피해, 지원"
1449,"법원, 사법보좌관, 업무, 절차"
1450,"풍수해보험, 손해평가인, 재해취약지역, 방재지구"
1438,"농어업, 농어업인, 농특위원회, 여성농어업인"
1131,"산업, 경쟁력, 부품, 지원"
1133,"금치산자, 한정치산자, 피성년후견인, 피한정후견인"
429,"보험회사, 보험계약자, 손해사정, 과태료"
1451,"적합성평가, 국가표준, 산업통상자원부장관, 무역"
1326,"휴면예금, 서민금융진흥원, 서민금융, 출연"
1452,"양자응용기술, 산업, 정보통신, 지원"
730,"물류산업, 물류기업, 국제물류, 물류공동화"
1075,"축산물, HACCP, 검사, 영업자"
1453,"주민등록번호, 증명서, 변경, 개인정보"
54,"교육훈련, 학습근로자, 기업, 고용노동부장관"
4,"중소기업, 지원, 창업자, 제조업"
1455,"소재, 연구기관, 연구개발, 승격"
139,"상속세, 증여세, 공제, 과세"
1456,"과태료, 결손처분, 징수, 체납처분"
1454,"청년, 청년정책, 국가, 지방자치단체"
1457,"영화, 영화산업, 영화진흥위원회, 영화상영관"
395,"고용, 재정지원, 일자리, 고용노동부장관"
950,"건설산업, 발주자, 수급인, 공사대금"
