cluster,cluster_keyword
6,"외국인, 송환, 입국불허, 송환대기실"
0,"임원, 공제금, 중소기업, 규정"
5,"어린이안전, 어린이공원, 안전교육, 안전시설"
24,"6·25전쟁, 무공훈장, 국방부장관, 공로자"
12,"벌금형, 법정형, 형사처벌, 범죄억지력"
7,"가축, 축산물, 이력관리, 가금"
16,"한국마사회, 장외발매소, 농축산물, 농업인"
17,"증인, 국회, 출석, 국정감사"
22,"대한민국재향경우회, 보조금, 정치활동, 운영"
18,"후원회, 예비후보자, 선거구, 국회의원"
23,"다문화가족, 다문화가족지원센터, 기본계획, 홍보영상"
25,"실태조사, 영양사, 법률, 규정"
3,"중소기업, 기금, 손해금, 동반성장"
19,"선거구, 선거, 국회의원, 부칙"
26,"국가교통위원회, 민간위원, 공무원, 형법"
27,"대규모유통업자, 납품업자, 공정거래위원회, 분쟁조정"
35,"장애인, 장애인복지, 법률, 규정"
38,"응급의료, 응급환자, 구급차, 자동심장충격기"
40,"인사행정, 공무원, 임용, 징계"
41,"지방선거, 의원, 정수, 시의회"
46,"신고, 보장계약, 처리절차, 신고수리"
47,"자동차, 자동차제작자, 임시운행, 대체부품"
48,"운송사업자, 운수종사자, 여객자동차, 영상기록장치"
53,"산업재산권, 조정, 특허청, 조정기간"
55,"외국인투자기업, 경제자유구역, 국내복귀기업, 국·공유재산"
54,"교육훈련, 학습근로자, 기업, 고용노동부장관"
64,"생물다양성, 유전자원, 생태계서비스, 멸종위기 야생생물"
56,"여가, 휴가, 국민, 직장인"
57,"수산자원, 자율관리어업, 어업인, 포획·채취"
63,"비료, 비료생산업자, 비료수입업자, 행정제재처분"
65,"국회의원, 보좌직원, 임용, 4촌 이내 혈족·인척"
66,"부정경쟁행위, 사법경찰관리, 특허청, 침해"
67,"예산안, 세입, 국회, 지방자치단체"
68,"국가유공자, 보상금, 적용대상, 법"
74,"대통령당선인, 국무총리, 국무위원, 인사"
77,"실내공기질, 건축자재, 오염물질, 측정"
75,"식품수출, 식품인증, 지원기관, 지원"
76,"형식승인, 컨테이너, 선박, 안전점검"
78,"급경사지, 안전관리, 재해예방, 자연재해대책법"
83,"영양소 섭취기준, 영양사, 보건복지부장관, 고시"
85,"특허권, 침해, 손해배상, 생산능력"
84,"신기술, 규제, 신산업, 우선허용·사후규제"
91,"벌금형, 징역형, 법정형, 범죄억지력"
95,"항만, 해양수산부장관, 사업, 등록"
96,"한국수출입은행, 해외 현지법인, 출자, 업무"
14,"승자투표권, 벌칙, 경주사업, 유사행위"
97,"폐기물, 부적정처리, 처리업자, 과징금"
94,"벌금형, 법정형, 징역, 국민권익위원회"
103,"항만시설, 보안장비, 보안, 폐쇄회로 텔레비전"
104,"결산, 예산, 국회, 사업별설명서"
111,"묘, 종자, 육묘업, 품질표시"
105,"산림, 목재, 교육, 관리"
134,"정관, 기타공공기관, 공기업, 준정부기관"
112,"저작권, 저작권법, 일부개정법률안, 문화체육관광위원회"
113,"고용안정, 산업전환, 지원, 근로자"
114,"양육비, 가정법원, 심판, 허가"
90,"법정형, 행정형벌, 위헌성, 처벌"
115,"곤충산업, 곤충생산업, 곤충가공업, 신고"
116,"법인세, 중소기업, 세율, 법률안"
125,"지방세외수입금, 지방자치단체, 징수, 납부"
132,"학교용지, 학교용지부담금, 개발사업, 교육감"
117,"공공임대주택, 입주자, 삶의 질, 지원"
123,"교육통계조사, 초·중등교육, 법적 근거, 자료"
129,"창업, 지원, 창업기업, 중소벤처기업부장관"
131,"회계법인, 공인회계사, 감사, 분할"
130,"국제개발협력, 한국국제협력단, 주관기관, 시행기관"
133,"장기등기증자, 장기등기증, 생명나눔, 유족"
136,"개별소비세, 세율, 납세, 세입예산안"
143,"자동차, 보험, 폐차, 구상"
135,"개별소비세, 연료, LPG, 에너지"
140,"환자안전, 환자안전사고, 보건복지부장관, 의료기관"
142,"풍수해보험, 소상공인, 시설물, 피해복구"
141,"학교도서관, 사서교사, 배치, 대통령령"
0,"임원, 공제금, 중소기업, 규정"
144,"법률, 개정, 혼란, 제명"
145,"농약, 수출입식물방제업, 농촌진흥청장, 농약안전정보시스템"
146,"화물자동차, 운송사업, 운임, 위수탁계약"
147,"금융투자업자, 투자자, 사모집합투자기구, 증권"
152,"제2연평해전, 전사자, 보상금, 군인연금법"
107,"산지, 대체산림자원조성비, 국유림, 산림청장"
153,"학교안전사고, 학교안전공제, 보상, 피해자"
155,"전통시장, 안전시설물, 시설현대화사업, 안전점검"
154,"피후견인, 결격사유, 성년후견, 행위능력"
156,"의료기관, 의료인, 보건복지부령, 환자"
157,"제대군인, 적용 대상, 장기복무, 법"
158,"노인학대, 노인, 벌칙, 전용쉼터"
163,"수급사업자, 원사업자, 기술자료, 하도급대금"
165,"건물표시변경등기, 과태료, 건축법, 부동산등기법"
164,"동물, 학대, 등록, 처벌"
166,"피성년후견인, 피한정후견인, 금치산자, 한정치산자"
167,"광역교통, 대도시권, 국토교통부장관, 광역교통대책"
168,"지방채, 지방자치단체, 발행, 재정"
136,"개별소비세, 세율, 납세, 세입예산안"
170,"어린이, 고카페인, 판매 금지, 학교"
169,"응급처치교육, 유치원, 교직원, 유치원생"
171,"성희롱, 여성, 성인지 교육, 여성가족부장관"
172,"의사상자, 의사상자심사위원회, 구조행위, 의료급여"
173,"공증, 촉탁인, 인증, 공증담당영사"
174,"법률, 제명, 개정, 혼란"
185,"우리사주, 우리사주조합, 우리사주제도, 환매수"
175,"건축물, 소유자, 건축허가, 전산자료"
95,"항만, 해양수산부장관, 사업, 등록"
176,"국산밀, 수요기반, 생산, 자급률"
178,"소상공인, 지원, 피해, 상거래"
182,"정원, 수용, 한국수목원관리원, 토지"
183,"기상관측, 기상측기, 형식승인, 기상청장"
7,"가축, 축산물, 이력관리, 가금"
184,"사립학교, 교원, 육아휴직, 학교법인"
105,"산림, 목재, 교육, 관리"
136,"개별소비세, 세율, 납세, 세입예산안"
50,"교통안전, 교통수단, 교통안전관리자, 교통안전담당자"
186,"가축전염병, 방역, 검역, 지방자치단체"
38,"응급의료, 응급환자, 구급차, 자동심장충격기"
187,"가스용품, 표시, 제조일자, 안전"
194,"항만재개발사업, 항만구역, 해양수산부장관, 주변지역"
217,"소상공인, 중소기업, 대기업, 적합업종"
191,"신재생에너지, 한국수자원공사, 수자원개발시설, 사업"
195,"노동조합, 근로자, 단체협약, 부당노동행위"
200,"운전면허, 운전자, 교통사고, 도로"
205,"고등학교, 무상교육, 공민학교, 교육"
206,"이스포츠시설, 이스포츠, 생활 이스포츠시설, 인터넷컴퓨터게임시설제공업"
207,"법률, 한자어, 일본식 용어, 한글화"
213,"연구기관, 자체감사, 국가과학기술연구회, 연구회"
212,"사업재편, 기업, 지원, 특례"
214,"고압가스, 사용시설, 안전관리, 제조허가"
220,"사립학교 교직원, 분할연금, 재해보상, 공무원연금법"
219,"학교, 학생, 보건교사, 응급처치"
221,"장애인, 고용, 인식개선 교육, 사업주"
222,"항만시설, 국제항해선박, 보안, 경비·검색"
224,"누리과정, 유아교육, 특별회계, 지방교육재정교부금"
223,"재정비촉진지구, 재정비촉진사업, 지정, 해제"
226,"미세먼지, 저감, 대기오염물질배출시설, 비상저감조치"
235,"병해충, 신고, 식물, 연구자"
236,"영유아, 어린이집, 보육, 보호자"
230,"관광, 관광사업, 관광특구, 지정"
237,"암환자, 암관리, 의료비 지원, 지원대상자"
238,"선박소유자, 선원, 임금, 실습선원"
239,"군인, 임용, 성폭력범죄, 휴직"
166,"피성년후견인, 피한정후견인, 금치산자, 한정치산자"
240,"원자력안전법, 허가, 결격사유, 발전용원자로"
124,"지방자치단체, 지방재정, 예산, 지방의회"
241,"특수교육, 특수학교, 장애인, 학칙"
242,"공공보건의료, 책임의료기관, 공공보건의료기관, 공공보건의료 지원단"
243,"조정, 조정제도, 조정절차, 분쟁"
244,"정보통신융합등 기술·서비스, 임시허가, 규제특례, 신기술·서비스심의위원회"
245,"국립항공박물관, 항공문화, 항공산업, 국토교통부장관"
78,"급경사지, 안전관리, 재해예방, 자연재해대책법"
246,"법원조직법, 판사, 재판연구원, 정년"
247,"지방문화원, 설립인가, 인가, 처리기간"
248,"감정평가사, 감정평가법인, 감정평가, 자격"
250,"신라왕경, 핵심유적, 복원·정비, 문화재청장"
249,"자연공원, 공원관리청, 과태료, 공원보호협약"
251,"수입식품, 해외제조업소, 식품의약품안전처장, 현지실사"
198,"산업재해, 근로자, 안전, 보건"
257,"개인회생절차, 채무총액, 산정기준시점, 신청"
260,"건축물, 내진능력, 피난, 설치"
259,"사업재편계획심의위원회, 제척, 회의록, 공정성"
258,"시험·검사기관, 위해성평가, 지정, 관리"
126,"지방자치단체, 기금, 지방채, 재정"
107,"산지, 대체산림자원조성비, 국유림, 산림청장"
263,"교통, 국토교통부장관, 지방자치단체, 권한"
264,"과태료, 이의제기, 징수, 질서위반행위규제법"
265,"중증장애인, 장애인, 생산시설, 지원"
98,"폐기물처리시설, 설치, 지방자치단체, 주민편익시설"
284,"정신질환자, 정신보건법, 법률, 개정"
266,"교원, 임용, 양성평등, 과학기술정보통신부장관"
266,"교원, 임용, 양성평등, 과학기술정보통신부장관"
86,"상표, 출원, 등록, 전문기관"
42,"지방자치법, 교육위원회, 지역 개발, 법률"
278,"선행기술조사, 전문기관, 특허출원, 특허청장"
267,"제대혈, 제대혈은행, 부적격, 연구 목적"
268,"금융서비스, 금융규제, 금융위원회, 혁신금융서비스"
273,"고엽제후유의증, 국가보훈처장, 고용, 과태료"
204,"어린이통학버스, 운행기록장치, 안전운행, 도로교통법"
285,"송전선로, HVDC, 보상, 지원사업"
276,"국가유공자, 지원, 파독, 광부·간호사"
287,"항공기, 항공보안, 처벌 강화, 보안검색"
291,"재외공무원, 소환, 징계, 하위법령"
292,"악취, 악취관리지역, 악취배출시설, 배출허용기준"
293,"어선원, 재해보상보험, 요양급여, 심사"
295,"체육시설, 체육교습, 체육시설업, 신고"
294,"궤도사업, 허가, 신고, 절차"
296,"자금지원, 기금, 국민경제, 기업"
81,"위험물질, 운송, 안전관리, 차량"
58,"낚시어선, 낚시, 영업, 안전"
302,"선박, 해양오염, 연료유, 방제"
301,"건강보험료, 보험료, 지역가입자, 직장가입자"
308,"부마민주항쟁, 위원회, 진상규명, 보상"
303,"금융거래정보, 부실관련자, 예금보험공사, 금융회사"
309,"국제거래, 조세회피, 국외특수관계인, 정상가격"
307,"언론중재, 중재위원, 결격사유, 언론사"
310,"전기자전거, 자전거, 안전, 운행"
311,"연구실안전환경관리자, 연구주체의 장, 직무, 과태료"
312,"철도차량, 안전, 국토교통부장관, 철도운영자"
316,"스마트도시, 국가시범도시, 규제, 산업"
317,"중소기업, 지원사업, 중소벤처기업부, 육성"
318,"방송통신발전기금, 방송통신재난관리계획, 과학기술정보통신부장관, 방송통신위원회"
319,"자치분권, 자치분권위원회, 지방자치단체, 중앙행정기관"
320,"수산물, 위판장, 위생관리, 현대화"
253,"표시·광고, 식품, 식품의약품안전처장, 부당한 표시·광고"
136,"개별소비세, 세율, 납세, 세입예산안"
321,"공동주택, 외부회계감사, 관리사무소장, 입주자대표회의"
322,"어린이집, 국공립어린이집, 보육, 표준보육비용"
323,"학교급식, 경비 지원, 농수산물, 식재료"
324,"자살예방, 실태조사, 자살시도자, 정보제공"
191,"신재생에너지, 한국수자원공사, 수자원개발시설, 사업"
326,"여객자동차 운수사업, 운수종사자, 전액관리제, 사납금제"
325,"식품위생교육, 영업자, 행정처분, 동업자조합"
327,"일본식 한자어, 한글화, 법률 용어, 쉬운 우리말"
328,"직업능력개발훈련, 훈련비용, 부정수급, 사업주"
90,"법정형, 행정형벌, 위헌성, 처벌"
317,"중소기업, 지원사업, 중소벤처기업부, 육성"
333,"한국학교, 재외국민, 인성교육, 임원"
329,"선박투자회사, 선박운용회사, 사모펀드, 자본시장"
136,"개별소비세, 세율, 납세, 세입예산안"
334,"연구개발특구, 실시계획, 지정해제, 규제특례"
339,"화학물질, 유해성평가, 척추동물시험, 등록"
159,"장기요양기관, 수급자, 공단, 장기요양급여"
317,"중소기업, 지원사업, 중소벤처기업부, 육성"
340,"산지전용, 수목원, 벌금, 징역"
341,"환승센터, 교통, 계획, 빅데이터"
342,"유전자변형생물체, 생산공정이용시설, 안전관리, 이용승인"
274,"독립유공자, 유족, 지원, 생활"
343,"자활지원사업, 수급자, 보장기관, 자활기업"
186,"가축전염병, 방역, 검역, 지방자치단체"
14,"승자투표권, 벌칙, 경주사업, 유사행위"
344,"직장 내 성희롱, 사업주, 피해근로자, 과태료"
345,"건설업자, 하도급, 건설공사, 직접시공"
251,"수입식품, 해외제조업소, 식품의약품안전처장, 현지실사"
28,"하도급대금, 수급사업자, 원사업자, 분쟁조정"
350,"외무공무원, 파견, 퇴직, 국가공무원법"
351,"청소년, 청소년유해약물등, 청소년보호, 출입금지"
352,"전통문화, 진흥, 국가, 지방자치단체"
353,"산업단지, 개발계획, 기반시설, 용지"
207,"법률, 한자어, 일본식 용어, 한글화"
354,"청소년, 인터넷신문, 유해, 과징금"
355,"양식업, 어업, 지원, 육성"
360,"문화산업, 전문인력, 양성기관, 지정"
364,"폐지, 공유수면관리법, 공유수면 관리 및 매립에 관한 법률, 법률"
365,"주거급여, 주거지원, 주거안정, 부양의무자"
125,"지방세외수입금, 지방자치단체, 징수, 납부"
33,"장애인연금, 중증장애인, 장애등급, 장애정도"
85,"특허권, 침해, 손해배상, 생산능력"
148,"부동산투자회사, 주식, 공시, 주주총회"
366,"교원, 노동조합, 고등교육법, 교섭"
367,"농식품 벤처·창업, 국고보조, 법적 근거, 지원"
370,"간선급행버스체계, 운송사업, 면허, 여객자동차 운수사업법"
378,"농산업, 농업기술, 연구개발, 실용화"
373,"아동·청소년, 간음, 추행, 공소시효"
374,"세무사, 자격, 압류, 공매"
379,"해외긴급구호, 해외긴급구호기본대책, 활동결과, 평가결과"
357,"어장, 어업, 기본계획, 등록"
380,"협동조합, 연합회, 인가, 신고"
381,"농업경영체, 임업, 임업인, 임야"
388,"임용, 군무원, 신원조사, 연령"
382,"가맹본부, 가맹점사업자, 징벌적 손해배상, 서면실태조사"
390,"자격증, 검정기관, 농수산물, 지정"
389,"자동차, 운행정지, 등록원부, 대포차"
391,"비지정기부금품, 국제보건의료, 감염성 질환, 글로벌 펀드"
11,"벌금형, 징역형, 형사처벌, 범죄억지력"
393,"민간자격, 민간자격관리자, 변경등록, 결격사유"
392,"선박, 항만, 해양수산부장관, 선박관리산업"
178,"소상공인, 지원, 피해, 상거래"
282,"자살예방, 자살시도자, 자살자 가족, 심리적 지원"
394,"치료명령, 스토킹행위, 피해자, 잠정조치"
395,"고용, 재정지원, 일자리, 고용노동부장관"
92,"벌금형, 징역형, 형사처벌, 범죄억지력"
329,"선박투자회사, 선박운용회사, 사모펀드, 자본시장"
399,"성매매 예방교육, 여성가족부장관, 시·도지사, 전문기관"
398,"시ㆍ도, 국가, 이양, 사무"
396,"자동차사고, 분담금, 보험회사, 개인정보"
397,"농지, 농업인, 노후생활안정자금, 자조금단체"
400,"사할린동포, 영주귀국, 정착 지원, 피해구제"
401,"골재채취업, 과태료, 신고, 허가"
402,"임차인, 임대인, 계약갱신요구권, 권리금"
403,"수생태계, 수질, 조사, 건강성"
404,"성년후견, 한정후견, 금치산, 한정치산"
405,"대중문화예술인, 대중문화예술기획업자, 성교육, 범죄예방"
406,"포장재, 재활용, 자원순환, 1회용 컵"
407,"수의사, 동물원, 수족관, 처방전"
208,"한글화, 법률용어, 한자어, 일본식 용어"
197,"파견근로자, 공중위생, 양벌규정, 명확성의 원칙"
409,"문화재수리, 문화재수리기술자, 신고, 업자"
60,"해양심층수, 해양심층수기본계획, 연도별계획, 시·도지사"
412,"간척지, 간척지활용사업, 간척지활용사업구역, 수산동식물"
90,"법정형, 행정형벌, 위헌성, 처벌"
38,"응급의료, 응급환자, 구급차, 자동심장충격기"
418,"택시운송사업, 차고지, 공영차고지, 공동차고지"
413,"해안권, 내륙권, 발전, 개발사업"
419,"국회미래연구원, 국가, 연구, 발전"
263,"교통, 국토교통부장관, 지방자치단체, 권한"
131,"회계법인, 공인회계사, 감사, 분할"
420,"농지, 농업진흥지역, 농지보전부담금, 타용도 일시사용허가"
424,"한국문학번역원, 문학, 출판, 간행물"
423,"농업기계, 임대사업, 기본계획, 시행계획"
426,"안전성검사기관, 수산물, 유해물질, 지정"
425,"수의사, 동물진료업, 면허, 과징금"
427,"개인정보, 가명정보, 개인정보 보호위원회, 정보통신망 이용촉진 및 정보보호 등에 관한 법률"
225,"배출가스, 자동차, 부품, 환경부장관"
428,"항공보안, 승객, 위해물품, 생체정보"
177,"소상공인, 소상공인시장진흥공단, 지원, 사업"
429,"보험회사, 보험계약자, 손해사정, 과태료"
357,"어장, 어업, 기본계획, 등록"
433,"치료감호심의위원회, 법무부, 고위공무원단, 일반직공무원"
434,"해수욕장, 관리·운영, 조례, 개장기간"
48,"운송사업자, 운수종사자, 여객자동차, 영상기록장치"
292,"악취, 악취관리지역, 악취배출시설, 배출허용기준"
436,"법관, 고등법원 부장판사, 윤리감사관, 정치적 중립성"
435,"노숙인, 노숙인시설, 유류금품, 민법"
0,"임원, 공제금, 중소기업, 규정"
437,"신고, 신고수리, 처리기간, 통지"
438,"크루즈산업, 기본계획, 시행계획, 육성"
439,"변호사시험, 법학전문대학원, 석사학위, 응시기간"
118,"민간임대주택, 촉진지구, 공공지원민간임대주택, 임대사업자"
446,"교원소청심사위원회, 교원, 소청심사, 권익보호"
447,"농외소득, 농촌융복합산업, 농림축산식품부장관, 지원"
441,"철도시설, 철도건설사업, 국토교통부장관, 철도국유재산"
440,"토양오염, 오염토양, 정화, 이력정보"
119,"소규모주택정비사업, 주민합의체, 사업시행계획, 인허가"
392,"선박, 항만, 해양수산부장관, 선박관리산업"
448,"소방공무원, 소방청, 국가공무원, 시·도지사"
449,"국제문화교류, 진흥, 문화체육관광부장관, 전담기관"
450,"국민연금, 연금보험료, 수급권, 반환일시금"
454,"어업재해, 수산양식물, 입식비, 긴급 방류"
455,"납세증명서, 지방세, 체납관리, 해외이주"
456,"대변인, 공보수석비서관, 국회의장, 국회"
2,"여성기업, 소상공인, 지원, 공공기관"
335,"정부출연연구기관, 연구회, 지역조직, 융합연구"
118,"민간임대주택, 촉진지구, 공공지원민간임대주택, 임대사업자"
458,"산지, 산지전용허가, 태양광발전시설, 중앙산지관리위원회"
416,"사업시행자, 지역개발, 개발계획, 지정"
457,"한국언론진흥재단, 문화체육관광부장관, 사업계획, 결산보고서"
90,"법정형, 행정형벌, 위헌성, 처벌"
459,"방송통신심의위원회, 방송통신발전기금, 사업비, 환수"
297,"인터넷전문은행, 은행, 대주주, 신용공여"
460,"산후조리원, 산모, 신생아, 난임"
465,"제조물, 결함, 손해배상, 피해자"
461,"전통시장, 전기안전점검, 화재, 손해배상"
466,"기상산업, 기상사업자, 한국기상산업진흥원, 실태조사"
467,"국회, 법률, 용어, 문장"
468,"도시공원, 공원, 조성, 실효기간"
469,"민간인통제선이북지역, 산지관리, 보전산지, 산지관리종합계획"
470,"부패행위신고자, 인적사항, 권익위, 벌칙"
443,"철도산업, 해외진출, 철도협회, 국제협력"
471,"사회기반시설, 민간투자, 경찰, 공공청사"
472,"도핑 검사, 경륜·경정, 선수, 한국도핑방지위원회"
473,"민방위, 교육훈련, 통지서, 민방위대"
474,"선박, 안전, 해양수산부장관, 관제"
475,"민법, 제한능력자, 개정, 무능력자"
369,"여객자동차운송사업, 수요응답형, 노선버스, 운송사업"
478,"택시운송사업, 택시운수종사자, 운송비용, 소정근로시간"
479,"선박, 행정처분, 선박검사, 안전"
476,"건강가정, 가족, 지원, 계획"
477,"검체, 의료기관, 서면동의, 연구"
480,"국가연구개발사업, 참여제한, 중소기업, 연구개발"
481,"공익신고자, 보호조치, 공익신고, 구조금"
363,"법률, 개정, 정신질환자, 나이"
482,"여객자동차운수사업, 인허가, 신청, 운수종사자"
274,"독립유공자, 유족, 지원, 생활"
11,"벌금형, 징역형, 형사처벌, 범죄억지력"
435,"노숙인, 노숙인시설, 유류금품, 민법"
483,"치매, 치매안심센터, 공립요양병원, 치매환자"
484,"승강기, 승강기부품, 안전관리, 유지관리"
485,"교육통계조사, 교육, 시책, 통계"
486,"자동차손해배상, 정비요금, 자율주행자동차, 보험회사"
491,"대부업자, 과징금, 과태료, 소비자"
487,"수상레저기구, 동력수상레저기구, 안전, 등록"
492,"전자장치, 부착명령, 보호관찰, 재범"
78,"급경사지, 안전관리, 재해예방, 자연재해대책법"
269,"과징금, 금융지주회사, 과태료, 부과한도"
493,"성폭력, 현장 출동, 피해자, 경찰"
494,"교육위원회, 지방교육자치, 교육의원, 지방의회"
495,"행정중심복합도시, 세종시, 개발계획, 특별법"
496,"기금, 보증, 법률, 개정"
92,"벌금형, 징역형, 형사처벌, 범죄억지력"
500,"농지관리기금, 한국농어촌공사, 과세정보, 농어촌"
503,"식품·의약품, 안전기술, 연구개발사업, 참여제한"
207,"법률, 한자어, 일본식 용어, 한글화"
502,"중소기업, 기술혁신, 연구인력, 지원"
501,"동물, 학대, 영업, 벌칙"
327,"일본식 한자어, 한글화, 법률 용어, 쉬운 우리말"
504,"건축물에너지평가사, 제로에너지건축물, 인증, 결격사유"
510,"구강건강실태조사, 장애인, 실태조사, 구강보건"
511,"아동학대, 취업제한, 아동관련기관, 피해아동"
230,"관광, 관광사업, 관광특구, 지정"
509,"결격사유, 면허, 등록, 항공사업"
515,"지방세, 체납, 공매, 납부"
273,"고엽제후유의증, 국가보훈처장, 고용, 과태료"
519,"재난관리자원, 재난관리, 관리기관, 동원"
516,"지속가능 교통물류체계, 교통물류, 지방자치단체, 공영차고지"
518,"법 문장, 한글, 용어, 어문 규범"
517,"농약, 등록취소, 회수·폐기, 농촌진흥청장"
520,"연대보증, 채무, 감경, 면제"
521,"지방공사, 지방공단, 수사기관, 임직원"
11,"벌금형, 징역형, 형사처벌, 범죄억지력"
268,"금융서비스, 금융규제, 금융위원회, 혁신금융서비스"
523,"재난적의료비, 지원, 국민건강보험공단, 의료비"
522,"농어촌주민, 보건복지, 기본계획, 농어업인"
460,"산후조리원, 산모, 신생아, 난임"
524,"농산물우수관리, 우수관리인증기관, 농림축산식품부장관, 우수관리시설"
525,"접근매체, 전자금융거래, 보이스피싱, 본인확인"
528,"납북피해자, 피해위로금, 납북피해자보상및지원심의위원회, 통일부장관"
44,"시·도지사, 기초지방자치단체, 특별자치시, 예방교육"
93,"벌금형, 징역형, 벌금액, 형사처벌"
526,"벤처기업, 육성, 유효기간, 연장"
135,"개별소비세, 연료, LPG, 에너지"
130,"국제개발협력, 한국국제협력단, 주관기관, 시행기관"
529,"성충동 약물치료, 장애인, 아동ㆍ청소년, 간음ㆍ추행죄"
530,"후계농어업인, 농어업, 지원, 청년"
448,"소방공무원, 소방청, 국가공무원, 시·도지사"
531,"재산등록, 공직자, 등록의무자, 가상자산"
413,"해안권, 내륙권, 발전, 개발사업"
532,"품질인증, 수산물, 제도, 폐지"
536,"선거, 임원, 조합, 벌칙"
534,"살생물제, 생활화학제품, 안전관리, 승인"
533,"교육시설, 안전, 유지관리, 안전사고"
535,"예술인, 복지, 서면계약, 예술인복지재단"
537,"재외동포, 과태료, 보건복지부장관, 개발도상국"
538,"특별자치시장, 벌금, 법률, 징역"
540,"농업협동조합, 수의계약, 중소기업, 농산물"
