age,title,bill_id,bill_number,content,card_news_content
20,2018 평창 동계올림픽대회 및 동계패럴림픽대회 지원 등에 관한 특별법 일부개정법률안,PRC_X1G7F0B2B0K2C1T0S2I8J1H4D7T8Y8,2005379,대회 관계자의 중대범죄 경력조회 및 출입 제한 기준을 마련함,"안전한 대회, 깨끗한 스포츠!  철저한 경력조회로 안심하세요!"
20,환경기술 및 환경산업 지원법 일부개정법률안(대안),PRC_V2R0I0H2Q1R8I1X7L2J3P4L9M4T8Y4,2024725,국가연구개발사업 부정행위 방지 및 환경표지 제도 개선을 위한 법률을 마련함,"투명한 연구 환경 조성!  깨끗한 기술, 믿음직한 미래!"
20,문화재수리 등에 관한 법률 일부개정법률안(대안),PRC_O2V0J0A5A0B7G1Q4S5F0R5X7E2Z3F4,2024971,문화재 수리의 책임성과 전문성을 강화함,"소중한 문화유산, 더 안전하게!  전문가가 책임집니다!"
20,화재로 인한 재해보상과 보험가입에 관한 법률 일부개정법률안,ARC_P1Z6M0W6J3C0X1Y8M0X5F3O6R9P5H9,2000619,특수건물 소유자의 손해배상책임보험 담보 대상을 확대하고 가입 기준일을 세분화함,"특수건물 안전, 더욱 확실하게!  보험보장 빵빵해졌어요!"
20,전공의의 수련환경 개선 및 지위 향상을 위한 법률 일부개정법률안,PRC_Q1M9D0Q3O0J4V1H6M1H1A4Y8R1S6R5,2018937,전공의 수련환경 평가 결과 공표 근거를 신설함,"전공의 수련 환경, 이제 투명하게 공개!"
20,국가정보화 기본법 일부개정법률안,ARC_H1P6P0I8R2X2B1Q7G3O4G2K2V5G0B9,2001737,그린인터넷인증 제도를 폐지함,"복잡한 인증, 이제 그만!  더 편리한 인터넷!"
20,하도급거래 공정화에 관한 법률 일부개정법률안(대안),PRC_S1R7Q0V9U2F1R1S4W4G4Y5E4M2H2D5,2009691,구매확인서 의무 발급 및 관계 공무원 비밀엄수 위반 벌금액 조정과 과태료 부과기준 시행령 위임 근거를 마련함,"투명한 거래, 확실한 보호!  구매확인서 의무 발급!"
20,기업도시개발 특별법 일부개정법률안,PRC_Q1E6L0P7U2J6S1H3M2A6Y2Y9E0R3G4,2001192,기업도시개발사업 수용재결 신청기간을 2017년 12월 31일까지 연장함,"기업도시 개발, 재결 신청 기간 연장!  혜택 놓치지 마세요!"
20,가정폭력방지 및 피해자보호 등에 관한 법률 일부개정법률안(대안),PRC_V2N0M0H5D0B6G1L5N3I0O3W8F5B6C5,2024977,외국인 가정폭력 피해자 지원 및 아동 상담 치료 프로그램 제공을 확대함,"외국인 가정폭력 피해가족, 든든한 지원으로 안전하게!"
20,한국교직원공제회법 일부개정법률안,PRC_A1T7S0O6L1E3M1K5X0S4P2R2Z0Q8D2,2007371,교직원 공제회 급여 및 부담금 반환 청구권 소멸시효를 5년으로 신설함,"교직원 공제회, 5년 안에 꼭! 급여·부담금 돌려받으세요!"
20,농업생산기반시설 및 주변지역 활용에 관한 특별법 일부개정법률안(대안),PRC_N1Z7O0F9P2Z0F1B8H5M4D3E7F9C4J0,2010040,법률명 인용 오류를 현행 법률명으로 정비함,"법률명 오류, 이제는 끝!  정확한 법률 정보로 바뀝니다!"
20,간척지의 농어업적 이용 및 관리에 관한 법률 일부개정법률안,PRC_J1E9N1L1N0X5W1W0D0B1X2C9A7A5W9,2023582,법률 용어를 한글화하여 국민의 법 이해도를 높임함,쉬운 법률 용어로 바뀌었어요! 이제 법이 더 잘 보여요!
20,전기·전자제품 및 자동차의 자원순환에 관한 법률 일부개정법률안,ARC_R1I6E1B2D3U0B1E3A3F0X3K2D5E9I9,2004832,전기전자제품 재활용부과금 가산금 요율을 인하하고 폐자동차 내 기후변화유발물질 회수 인계 의무를 부여하며 폐자동차재활용업 등록제도를 개선함,폐기물 처리 부담 덜고 환경도 지켜요!
20,곤충산업의 육성 및 지원에 관한 법률 일부개정법률안,PRC_H1Y7D0F3Y1A6K1W6Q0A2U3O7P0X8L3,2006214,공무원으로 의제되는 위원회 민간위원 및 수탁 단체 임직원 범위를 확대함,투명한 위원회 운영! 시민 참여 확대!
20,국가연구개발사업 등의 성과평가 및 성과관리에 관한 법률 일부개정법률안,PRC_V1F9M0U2M1B3B1S0W0G6A5H0A2V0Z5,2018601,과학기술정보통신부장관의 성과평가기본계획 국회 보고 의무를 신설함,"국민 중심 과학기술 정책, 투명하게!"
20,콘텐츠산업 진흥법 일부개정법률안,PRC_B1C7J1J2Q2Q6Y1T0Z5S7D4P8Z4C7H0,2011013,법률 용어를 국민이 이해하기 쉽게 개선함,"쉬워진 법률 용어, 이제 딱! 이해 완료!"
20,정보통신망 이용촉진 및 정보보호 등에 관한 법률 일부개정법률안,PRC_S1Y8K1B1P2N8K1S5U4D9P0E6F3A5Z9,2016858,과징금 환급가산금 산정 기준을 개선함,과징금 돌려받자! 이자까지 더 받으세요!
20,접경지역 지원 특별법 일부개정법률안,ARC_R1D6M1F0C0H5D1F5F5G8V1L5Y4G4Q3,2002583,접경지역 발전을 위한 정책 심의 및 사업 추진 체계를 개선함,"접경지역, 더 밝은 미래를 향해!  발전 가속화!"
20,외국인투자 촉진법 일부개정법률안,PRC_V1K8D1Z1Q2D8T1A7M4Y1B5U8W4J1A5,2016868,외국인투자 촉진법을 개정하여 외국인투자 제도를 개선함,"외국인 투자, 더 쉬워졌어요!  경제 활력 UP!"
20,결혼중개업의 관리에 관한 법률 일부개정법률안,ARC_Q1D8G0F1Z0K3T1W6I1Z9I2T6H3V3X9,2011253,결혼중개업 등록 결격사유 제도를 개선함,"결혼 중개, 더 안전하게!  결격사유 개선으로 행복 보장!"
20,양곡관리법 일부개정법률안,ARC_R1Z6E1F2Z2F9D1A8L3L5Y2Y9Q4V5E2,2004801,양곡가공업 신고 처리절차를 명확히 규정하고 신고 수리 기준을 개선함,"양곡 가공업 신고, 이젠 더 쉽고 빠르게!"
20,지역특화작목 연구개발 및 육성에 관한 법률안,PRC_G1P8C0L4W2C6M1G4H3R3R4V8S3U4P5,2013263,지역특화작목 연구개발 및 육성에 관한 법률을 제정함,지역 농산물 품질 UP! 농가소득 UP!
20,국민건강증진법 일부개정법률안,PRC_H1U9A0R3R0E8X1N5W4Z9C1Y1J8Y7Y6,2019041,보건교육사 자격증 대여 알선 행위를 금지하고 위반 시 자격 취소 및 징역 또는 벌금형을 부과하는 법안을 신설함,보건교육사 자격증 불법 대여? 이제 끝!  철퇴!
20,건설기술 진흥법 일부개정법률안,PRC_K1G7N0T5U3X1H1A1I0Q5Y2C8Z7M8O5,2007113,건설기술인의 날을 제정하고 건설기술인 권익 보호를 위한 법적 장치를 마련함,"건설기술인 여러분, 권익 보호받으세요!"
20,중소기업 기술혁신 촉진법 일부개정법률안,PRC_G1H8P0W7Q1Q8N1O6O5C9G4T9W9G8A0,2014477,국회 소관 상임위원회에 기술혁신 지원계획 및 실적 자료 제출을 의무화함,"국회, 기술혁신 지원 확대!  미래 성장 힘찬 발걸음!"
20,울산과학기술원법 일부개정법률안,PRC_T1A7R0T2L1X0I1R1D3I0O5F3E0L4U6,2005549,울산과학기술원에 연구기자재 기부자와의 공동 사용 규정을 신설함,"울산과기원 연구장비, 함께 써요!  더 큰 혁신!"
20,대한민국예술원법 일부개정법률안,PRC_F1P8J0F6K2Z8B1A5V2H4V3J2F7N5G6,2014066,대한민국예술원 회원 자격 요건을 강화하고 임기를 종신제로 전환함,"대한민국 예술원, 명예와 권위 더욱 빛나요!"
20,전기용품 및 생활용품 안전관리법 전부개정법률안,PRC_Z1L7K0D9P0V4I1P6W4V9B0X9G0K9P7,2009058,생활용품 안전관리 제도를 개선하여 안전기준준수대상생활용품을 신설하고 구매대행업자와 병행수입업자에 대한 규제를 합리화함,"안전한 생활용품, 이제 믿고 사세요!"
20,소방시설공사업법 일부개정법률안(대안),PRC_S2Y0I0M5E1O4Y1W6X0K4O2W0H1V5J0,2024985,소방시설공사의 품질 향상 및 안전 강화를 위해 관련 법규를 개선함,"소방시설 안전, 확실하게 지켜드립니다!"
20,사행산업통합감독위원회법 일부개정법률안,PRC_K1M9M0B3X1M2O1S7C4O6X4P3O4W5K9,2019147,청소년 도박 문제 예방 및 관리체계를 강화함,"청소년 도박, 이제 걱정 끝! 건강한 미래 보장!"
20,도로교통법 일부개정법률안(대안),PRC_W1V8Z0I2E2N1O1A7U5E7N2E9U3Z8M4,2012199,교통안전 관련 규정을 강화하고 운전면허 제도를 개선함,"안전운전, 면허제도 개선! 교통사고 걱정 끝!"
20,사회복지사업법 일부개정법률안,PRC_Q1Z6S0R9B2S0D1W4C3P7W5I1F2T8S6,2002337,벌금형의 금액을 현실화하여 범죄억지력을 확보함,합리적인 벌금으로 범죄 걱정 끝!
20,성별영향분석평가법 일부개정법률안,PRC_W1P7Y1C2N2P8F1B5W1A3I1O3X8C2F2,2011075,성별영향분석평가 제도의 명칭을 변경하고 대상 정책을 확대하여 성평등 정책 효율성을 높임함,"성평등 정책, 더욱 효과적으로!  확대된 평가로 더 나은 미래!"
20,애니메이션산업 진흥에 관한 법률안,PRC_O1R7M0T8G3O1N1G5H3L8J4B9D9F7A4,2008906,애니메이션산업 육성 및 지원을 위한 법률을 제정함,"애니메이션, 이제 훨씬 더 빛날 거예요!"
20,초지법 일부개정법률안(대안),PRC_I1X9W0U9Y2A0T1L8P0C3C5V7G7H9A6,2023844,대체초지조성비 분할납부 및 초지용도변경 승인절차를 신설하고 원상회복 대상을 확대함,초지 걱정 끝!  분할납부·용도변경OK!
20,내수면어업법 일부개정법률안,ARC_P1Y6X1V2E2L8N1A4A0N4A3Y1H4O3Q5,2004665,내수면 어업 신고 처리 절차를 명확히 규정하고 신고 수리 여부를 5일 이내 통지하는 제도를 신설함,"내수면 어업 신고, 5일 내 답변! 속 시원하게 처리!"
20,자본시장과 금융투자업에 관한 법률 일부개정법률안(대안),PRC_F1X7H1F2O0P1D1A1W1I3W4V3J4R3N4,2012198,금융투자 관련 규제를 개선함,"금융투자, 더 쉬워졌어요!  규제 개선으로 편리함 UP!"
20,축산법 일부개정법률안,PRC_R1N6X0E6B2L4Z1A7H5V1U0F4M8W9X5,2000482,가축거래상인 등록 대상에 염소 거래업자를 포함함,염소 거래도 안전하게!  등록제 확대로 믿음UP!
20,민간인 통제선 이북지역의 산지관리에 관한 특별법 일부개정법률안,PRC_G1U9R1P1M0U4R1B6N1M1A3Q5A2O2O3,2023563,법률 용어를 쉬운 우리말로 바꾸어 국민의 법 이해도를 높임함,"딱딱한 법률 용어, 이제 쉽게 이해하세요!"
20,원자력안전위원회의 설치 및 운영에 관한 법률 일부개정법률안(대안),PRC_C1D9J0S7J1A2X0C9N2T0G2M8W8F1K3,2021762,원자력안전위원회 위원 결격사유를 명확히 하고 공무원이 아닌 위원에 대한 청렴의무와 벌칙을 신설함,"원자력 안전, 더 투명하고 안전하게!  위원 윤리 강화!"
20,수도법 일부개정법률안(대안),PRC_C1P7G0B9H2B0F1G1C2J1K5N5E0C6E9,2010358,수도용 자재 및 제품의 안전관리 및 보상규정을 강화함,"안전한 수돗물, 확실하게 보상받으세요!"
20,양성평등기본법 일부개정법률안(대안),PRC_F2N0V0Q2G2X4H0M9Z5P1R4E1Z8O8L1,2024917,시도 양성평등위원회 설치 및 양성평등 임금의 날을 신설함,"양성평등, 이젠 현실로!  임금격차 해소, 함께 만들어요!"
20,부정경쟁방지 및 영업비밀보호에 관한 법률 일부개정법률안,PRC_U1B6T0I7M2U5W1R5H3A7M2L0P3W2P0,2001143,부정경쟁행위 조사 대상을 확대함,"불공정 경쟁, 이제 걱정 끝! 더 강력한 보호!"
20,중소기업 인력지원 특별법 일부개정법률안(대안),PRC_E1Q8T0T9U1N8V1A1M2B0G4O0Z8V2T9,2016534,중소기업 청년근로자에 대한 세액감면 근거와 근로시간 단축 지원 방안을 신설함,"청년 근로자, 세금 혜택 팡팡! 일도 삶도 행복하게!"
20,한국보건의료인국가시험원법 일부개정법률안,PRC_C1A7R0R7W1P7F1V2J0R1G0D9Q9U5N9,2008873,직무상 비밀 누설시 벌금 상한액을 2천만원으로 상향함,직무상 비밀 누설? 벌금 최대 2천만원!
20,아동수당법안(대안),PRC_N1H8F0E2L2X2N1T1K1K2I5L3V6D6H7,2012257,6세 미만 아동에게 소득 수준을 고려한 아동수당 지급 제도를 신설함,"6세 미만 아동, 맞춤형 아동수당 받자!"
20,대도시권 광역교통 관리에 관한 특별법 일부개정법률안(대안),PRC_Z2X0H0Y5U0Z7I1F1T1E7L4K8Y1N4M2,2024953,광역버스 운송사업 정의를 신설하고 광역교통시설부담금 사용 범위를 확대하며 광역철도 심의 조정 대상을 명시함,"광역버스 이용 편리해지고, 교통 환경도 개선!"
20,여신전문금융업법 일부개정법률안,ARC_M1R6C1Z1R3H0Y1V7B0J1J5C1J0R4S7,2003990,여신전문금융회사 등 임원 제재규정을 강화하고 과징금 과태료 부과한도를 인상함,불법 금융행위 OUT! 소비자 보호 강화!
20,주택법 일부개정법률안(대안),PRC_R1P9L0Q9H1H9D0D8T5S6V1A0Z2V5H7,2023835,주택조합 가입 관련 규정을 신설하고 관리 감독을 강화함,"주택조합, 투명하게! 안전하게!  내 집 마련 든든하게!"
20,공공기관의 운영에 관한 법률 일부개정법률안(대안),PRC_L1H6S1W1R2A9A1E5Y4L8R3N9P3P0A8,2004207,공공기관 기능조정 계획 국회 보고 및 공기업 준정부기관 임원추천 과정 투명성을 강화함,"공공기관, 더 투명하게! 국민 여러분께 힘이 됩니다!"
20,농수산물 유통 및 가격안정에 관한 법률 일부개정법률안(대안),PRC_I1D6B1Z1R1A0K1U7W1K1T2T2K8X1Y3,2003640,농수산물 유통 정보시스템 구축 및 채소류 등 수급 안정 사업 추진 근거를 마련함,싱싱한 채소 더 싸게! 농산물 유통 정보 시스템 구축!
20,총포·도검·화약류 등의 안전관리에 관한 법률 일부개정법률안(대안),PRC_E1U8I0J5C2O4N1J7U0O7K3R5Z3A4I8,2015142,총포 관리 및 불법 총기류 단속을 강화함,불법 총기 없는 안전한 사회! 총기류 단속 강화!
20,국립묘지의 설치 및 운영에 관한 법률 일부개정법률안,PRC_Q1Z8H0E2F0N9Y1K0G5I0M2Z4M0J2C1,2011870,국립묘지 안장 대상 선정 관련 분쟁 해결을 위한 법적 근거를 마련함,"국립묘지 안장, 이제 더 공정하게!"
20,수소경제 육성 및 수소 안전관리에 관한 법률안(대안),PRC_E1P9A1A1N2H1Q1D8Z4F5U1G8S0W6L3,2024005,수소경제 이행을 위한 기반을 조성하고 수소산업을 체계적으로 육성하며 안전 관리를 강화함,"수소경제 활짝! 깨끗한 미래, 안전하게!"
20,국립대학법인 인천대학교 설립·운영에 관한 법률 일부개정법률안,PRC_G1J9K0C8R0V9M1S4P5S5Y2Y7I0N4U9,2021922,인천대학교 교원의 영리업무 및 겸직금지에 관한 특례를 명시함,"인천대 교수님들의 연구 활동, 더욱 투명하게!"
20,농수산물 품질관리법 일부개정법률안,PRC_E1N7B0R3K1B5A1Z4G2E9W4C6L5T9J8,2006168,농산물 포장 판매 시 권장품질표시 기준 및 방법을 마련함,"농산물 품질, 이젠 믿고 사세요! 👍"
20,먹는물관리법 일부개정법률안(대안),PRC_T1J8G1Z1Y2G7X1G7I2G4V0P1N0Q3B9,2017091,정수기 정의를 확대하고 불법 정수기 표시를 금지하며 부정한 방법으로 지정된 검사기관의 재지정 제한기간을 강화함,"안전한 정수기, 이제 확실하게!  불법 표시 NO!"
20,구직자 취업촉진 및 생활안정지원에 관한 법률안(대안),PRC_F2N0L0R5K1F1B0I9T1A8W5X9T5K1H0,2024941,저소득 구직자에 대한 취업지원 서비스 제공 및 구직촉진수당 지급 근거를 마련함,취업 걱정 끝!  구직자 지원으로 취업 성공!
20,연안관리법 일부개정법률안,PRC_W1X8J0A9X0K6O1N6F4T2D3Q2S2L5H4,2015360,해수면 상승에 대응하는 연안 해역 관리 근거를 마련함,"안전한 연안, 든든한 미래! 해수면 상승 걱정 끝!"
20,방위산업 발전 및 지원에 관한 법률안(대안),PRC_N1A9Q1U1Z1T9H1F1H0E2L0A4R6O3R5,2024051,방위산업 발전을 위한 법률을 신설함,"강한 국방, 튼튼한 경제! 방산업 발전 힘찬 도약!"
20,산업단지 인·허가 절차 간소화를 위한 특례법 일부개정법률안,PRC_E1S7C1V2C1X8H1J1T2D1I4I1A1C6L8,2010891,산업단지계획심의위원회 운영 및 심의 절차를 개선함,"산업단지 심의, 더 빨라지고 투명해졌어요!"
20,새만금사업 추진 및 지원에 관한 특별법 일부개정법률안(대안),PRC_N1Z9N0L8R2B0U1I5P1C5A1X5J9Y5C5,2024053,새만금사업 추진을 위한 사업시행자 관리감독 및 외국인 투자 활성화 방안을 마련함,"새만금, 외국인 투자 활성화로 더 큰 발전!"
20,여권법 일부개정법률안(대안),PRC_H1T7K0S2J2X2K0Q9D5T2C3F0O5S3K6,2005898,시각장애인 점자여권 발급 및 여권 발급 거부 기준을 강화하고 분실여권 효력상실 시점을 변경함,시각장애인도 편리하게!  점자여권 발급 확대!
20,대규모유통업에서의 거래 공정화에 관한 법률 일부개정법률안(대안),PRC_P1R7H1Q1B3Q0L1E7A5O4B5O1F9O8T4,2012011,대규모유통업자의 부당한 영업시간 구속 행위를 제한하고 신고포상금 환수 절차를 마련함,불공정 유통 관행 OUT!  상생 경제 활짝!
20,항공사업법 일부개정법률안,PRC_Z1M9K0O6S2N4O1L5M3A2K4W7W6O4Z8,2021095,국가기관 등의 드론 보험 가입을 의무화함,"드론 안전, 이제 걱정 끝! 국가가 책임집니다!"
20,형법 일부개정법률안,PRC_W1V6U0X7A2V9G1M7P4V8R2M2M3J7I8,2001301,외국 형 집행 내용을 국내 형량 산정에 반영하도록 형법 제7조를 개정함,"공정한 형벌, 이젠 국제 기준으로!"
20,항공사업법 일부개정법률안(대안),PRC_D1A6I1J2D2P1T1O9E5R9U4G0V3G3Y2,2004722,항공기 교육생 보호 및 항공보험 관리체계를 개선함,"안전한 비행교육, 확실하게 보장!"
20,환경오염시설의 통합관리에 관한 법률 일부개정법률안,PRC_N1X7J0V7D2Z8H1V0J4O1M4N5D5I7T8,2008259,기존 사업장의 통합허가 기준을 명확히 하여 법 적용 시기 충돌을 해소함,"사업장 통합허가, 이제 더 간편하게!"
20,군용항공기 운용 등에 관한 법률 일부개정법률안(대안),PRC_B1S9P0A8Y2Q1J1E1Q0B3U5G3L0O6L1,2023251,군 항공교통관제사 자격증명 관련 행정제재 및 처벌규정을 신설하고 벌금액을 상향 조정함,"안전한 하늘길 확보! 군 항공 교통관제, 처벌 강화!"
20,국유재산특례제한법 일부개정법률안,PRC_G1N8D0L9K0L7G1H4A4D1Q1R0X4H5K6,2015381,환경친화적 자동차 충전시설 민간사업자의 국공유지 임대료 감면 근거를 마련함,"친환경 자동차 충전, 더 편리하게!  국공유지 임대료 감면!"
20,자본시장과 금융투자업에 관한 법률 일부개정법률안(대안),PRC_Q1A7L0E2U2E4T1K6G5T5U2M5H9W7B1,2006490,자본시장 규제를 강화함,투자자 보호 강화!  자본시장 더 안전하게!
20,지방교부세법 일부개정법률안(대안),PRC_Q1U9W0G6T2C6K1F7W1A9Q2M9O1J2E2,2023890,소방안전교부세 재원을 담배 개별소비세의 45%로 상향하고 소방인력 인건비 사용을 허용함,소방관 처우 개선! 안전한 우리 동네를 위해!
20,집단에너지사업법 일부개정법률안,PRC_Y1R7F0G2F1C0A1P5G0U0D2M1N4Q4L2,2005556,행정법규 위반 행정형벌의 법정형 편차를 조정함,"행정벌 규정, 이제 더 공정해져요!"
20,초·중등교육법 일부개정법률안(대안),PRC_C1T6L1K1U2A4P1D5N5A7K1X2L9R3F6,2004016,학업중단숙려제 법적 근거를 마련하고 부정한 교육비 수급에 대한 벌칙 규정을 신설함,학업 중단 걱정 끝!  학생 위한 든든한 지원 시작!
20,댐건설 및 주변지역지원 등에 관한 법률 일부개정법률안(대안),PRC_B1G6X1L1D1D0O1B0S1C7T3R1R4D0O5,2003642,댐건설 절차를 개선하고 수자원 이용 효율성을 높이는 법률을 제정함,"물 부족 걱정 끝! 댐 건설, 더 효율적으로!"
20,6·25 전사자유해의 발굴 등에 관한 법률 일부개정법률안,PRC_P1Z7A0M8X2D1L1T6A5R7O5G4E0F6Q0,2008616,전사자 유해 발굴 관련 문화재보호법 조항을 개정함,"잊혀진 영웅, 기억하겠습니다! 전사자 유해 발굴 지원 강화!"
20,공유토지분할에 관한 특례법 일부개정법률안,PRC_Z1S7N0G2M0N3S1E5N3T1W5G3B7A4E4,2005418,공동주택 부지 내 복리시설 토지분할 특례법 시행기간을 10년으로 연장함,"쾌적한 공동주택, 10년 더!  복리시설 확대!"
20,환경정책기본법 일부개정법률안(대안),PRC_V1N8E0R3R1E3R1P8C2J7C2Q0U7W0V9,2017736,환경정의 및 기후변화 대응을 위한 환경정책기본법을 개정함,"쾌적한 환경, 밝은 미래! 환경법 개정으로 더 나은 내일을!"
20,음악산업진흥에 관한 법률 일부개정법률안,ARC_B1A8F0C7R3N1J1F4X3O4S5H3A2I1X0,2014660,신고 민원 처리절차를 명확히 규정하고 신고 수리 여부를 7일 이내 통지하는 제도를 신설함,"민원 신고, 7일 이내 답변! 속 시원한 처리 약속!"
20,동물원 및 수족관의 관리에 관한 법률 일부개정법률안,PRC_G1M7F1I0Y2F5L1Y6Q4O0C2G1D9Z8H4,2009918,동물원 수족관 동물복지 증진을 위해 환경부 산하 동물관리위원회를 신설함,동물들이 행복해요! 쾌적한 동물원 & 수족관 만들기!
20,소금산업 진흥법 일부개정법률안,PRC_Z1B6P1I1J0L1V1V7O5B4A1A0B0D5Y1,2003169,식용천일염 생산 금지 해역 위반 행위에 대한 처벌을 강화함,"깨끗한 소금, 엄격하게 지켜요! 불법 천일염 생산, 처벌 강화!"
20,온실가스 배출권의 할당 및 거래에 관한 법률 일부개정법률안,PRC_J1F9Z0Z9I0I5J1O0V5L2F5O4C8H7S6,2022345,온실가스 배출권거래제 관련 법률 규정을 개선함,"탄소중립, 더 가까워졌어요! 🎉"
20,축산물 위생관리법 일부개정법률안(대안),PRC_C1N8E0I9M1A9S1H8S0J7S5A3G7L3M1,2016580,축산물 위생관리 법령을 개선함,"안전한 먹거리, 더욱 깨끗하게! 축산물 위생관리 UP!"
20,국제조세조정에 관한 법률 일부개정법률안,ARC_M1R6Z0U9F0A2L2X0A3N4L2A6A4G9A7,2002112,국제거래 조세회피 방지 및 납세편의 제고를 위해 국제거래 관련 제도를 개선함,국제거래 투명하게! 세금 걱정 덜고 편리하게!
20,국토의 계획 및 이용에 관한 법률 일부개정법률안,PRC_L1L8U0A2U0J9E1L6E0K5X3D2B0K4Z0,2011888,개발행위 허가 대상에서 도시군계획사업을 명확히 제외함,"개발행위 허가, 더 간편해졌어요!"
20,곤충산업의 육성 및 지원에 관한 법률 일부개정법률안,PRC_K1E6K1Y1S2K1K1L7V0M2W0S9W5A0S9,2003754,곤충산업 발전을 위한 지원체계를 강화함,"곤충산업, 쑥쑥 커요!  든든한 지원으로 활짝!"
20,목재의 지속가능한 이용에 관한 법률 일부개정법률안,ARC_B1D6V0E7U1R4F1S7X3U9X0X8R5P5Z6,2000889,목재 관련 인증제도를 정비하고 규격품질검사 자율성을 강화하며 파산선고자에 대한 등록 제한을 완화하고 벌칙 적용 시 공무원 의제 대상을 확대함,목재산업 활력 UP!  규제 완화로 더 좋은 목재 만나요!
20,기업구조조정 촉진법안(대안),PRC_S1S8Z0B8B2A8D1D0W4E8D3U3A6E2G7,2015682,기업구조조정 촉진법의 유효기간을 5년 연장함,"기업 구조조정, 5년 더!  경제 활력 UP!"
20,장애인기업활동 촉진법 일부개정법률안(대안),PRC_O1J7O0F2C2A1R1N3H3R8Q0G6D6Y3I9,2005895,장애인기업 지원 관련 법적 근거를 마련하고 위장 장애인기업 단속을 강화함,"장애인기업, 더 든든하게!  정당한 지원 확대!"
20,농수산물 품질관리법 일부개정법률안,PRC_G1G7D1F2Q0M6G1O6D2F5Q3R6Q4H1I6,2010641,농수산물 생산가공시설 등록 관련 신고절차를 간소화하고 불필요한 행정조사를 제외하여 행정 효율성을 강화함,"농산물 생산, 이젠 더 쉽게! 신고절차 간소화!"
20,드루킹의 인터넷상 불법 댓글 조작 사건과 관련된 진상규명을 위한 특별검사의 임명 등에 관한 법률안(대안),PRC_F1O8N0V5X2O1D0C8P4S1S4Z7X0U5G7,2013660,드루킹 여론조작 사건 진상규명을 위한 특별검사 임명 및 수사 등에 필요한 사항을 규정함,"드루킹 사건, 진실 밝히겠습니다! 특검 수사로 진상규명!"
20,관광진흥법 일부개정법률안(대안),PRC_E1R8B0O9H1L1N2W0R3T4L0S5L4Q3R8,2016614,카지노업 사전신고제 및 관광산업 지원 근거를 마련하고 관련 규제를 개선함,"카지노 사업, 투명하게! 관광도 활짝!"
20,기상법 일부개정법률안,ARC_M1M6S1K2Q0K5H1O6S0S1G0F3K9C0W3,2004103,항공기상 관련 제도와 기상재해 대응 교육을 강화함,안전한 하늘길! 항공기상 안전교육 강화!
20,해외이주법 일부개정법률안,ARC_S1G6E0N6W3N0O1B5O1F0E2T9W0L5A4,2000598,해외이주 관련 법률 근거를 마련하고 제도를 개선함,"해외 이주, 더 쉽고 안전하게!  새로운 시작 응원합니다!"
20,선박관리산업발전법 일부개정법률안,PRC_U1S8I0J3F1I6Y1E7I4D2S1Y2C4G7M8,2012508,선박관리산업육성 기본계획 수립 및 시행 과정을 개선함,"대한민국 해운산업, 더욱 든든해집니다!"
20,어촌·어항법 일부개정법률안(대안),PRC_S1L8L1M2C1T2U1R6K0Q9S0R0K3Y7B1,2017756,어촌어항발전기본계획 수립 절차와 관련 용어를 개선함,"어촌어항 발전, 더 쉽고 투명하게!"
20,보험업법 일부개정법률안,PRC_G1Z8Y0P2Q2M8P1G7X0X9I2E2C0Q6Y9,2012240,보험회사의 금리인하요구권 제도를 신설하고 고지 의무를 부과하여 금융소비자 편의를 증진함,내 보험금 더 받자! 금리인하요구권 생겼어요!
20,중재산업 진흥에 관한 법률안,ARC_Q1K6K0I8W1A8E1P1L0N1W4S4A1P6Y1,2001639,중재산업 진흥 기반을 조성함,"중재산업 활성화로 분쟁 해결, 척척!"
