age,title,bill_id,bill_number,content,card_news_content
21,군사경찰의 직무수행에 관한 법률안(대안),PRC_O2N0W1B1U2O0A1C1K0D3B1D7W3Z0K8,2105929,군사경찰의 직무 범위와 무기 사용 등을 명확히 규정하여 군 인권 보호를 강화함,군인 인권 존중!  무기 사용 기준 명확해져요!
21,대·중소기업 상생협력 촉진에 관한 법률 일부개정법률안(대안),PRC_X2X0X0T9D1O5N1E7I5U7B4A7G7R9O4,2104159,중소기업 납품대금 조정 및 불공정거래 행위 제재를 강화함,"중소기업 납품대금, 제대로! 공정거래, 확실하게!"
21,문화재영향진단법안,PRC_O2O2W1P1C2I9Y1F7R5I9Q3F1U0Z6C7,2119032,문화재 보존과 개발사업 간 갈등을 해소하고 효율적인 문화재 영향 평가 체계를 마련함,"소중한 문화재, 더 안전하게!  발전과 보존, 함께 이뤄요!"
21,지역 개발 및 지원에 관한 법률 일부개정법률안,PRC_O2B1G0Q2L0Z2U1Q5L5Z4C5Q5D6K1U0,2108235,성장촉진지역 국비 보조금 지원범위를 기반시설 설치 운영비까지 확대함,지역발전 팍팍! 국비 지원 확대!
21,학교 밖 청소년 지원에 관한 법률 일부개정법률안(대안),PRC_X2T1R0T2T1V7E1F6Z5V0C1D2I5Y7X9,2108398,학교 밖 청소년 지원체계를 강화함,"학교 밖 청소년, 든든한 지원으로 힘내세요!"
21,인사청문회법 일부개정법률안,PRC_X2W0H0M6E0E1J1B1E4S1A2R6R5V1M4,2100015,고위공직자범죄수사처장을 인사청문회 대상에 추가함,공정한 인사청문회! 고위공직자 감시 강화!
21,식물방역법 일부개정법률안(대안),PRC_A2M3J0U6T2Q6H0S9Q4U6C5Q3M7P9D5,2124469,국가식물병해충통합정보시스템 구축 및 법률 용어를 개선함,"식물병 해충 정보, 이젠 쉽게! 확실하게!"
21,공연법 일부개정법률안,PRC_K2W2X0U2B2Q5P1S0M3Y6A3J3T8T0W7,2114852,매크로 프로그램 이용 암표 매매를 금지하고 위반 시 과태료를 부과하는 법안을 신설함,암표 없애고 공정한 티켓팅! 과태료 부과!
21,전파법 일부개정법률안(대안),PRC_W2F3K0A9X2E0J1I9D1G2H1S9Y6M8C2,2125988,전파차단장치 손실보상 및 적합성평가 제도를 개선함,"전파차단 장치, 보상받고 안전하게!"
21,시설물의 안전 및 유지관리에 관한 특별법 일부개정법률안,PRC_I2A0X0G8Q3L1S2X0Q4S1O5E8R7Q8J2,2103364,안전진단전문협회 설립 근거를 마련함,"안전한 사회, 이제 협회가 책임집니다!"
21,주택법 일부개정법률안(대안),PRC_L2B3I0N4U1M8Z1H6R1D9D5L3F9G8D9,2125977,주택사업 관련 규정을 강화하고 감리 및 택지 공급 시스템을 개선함,"내 집 마련, 더욱 안전하게! 주택사업 투명하게!"
21,법률용어 정비를 위한 문화체육관광위원회 소관 43개 법률 일부개정을 위한 법률안,PRC_Q2R3V0Y3A2E9C1I5V2Q7I1A7W3D7I9,2123308,법률 용어를 국민이 이해하기 쉽도록 순화하여 법률을 개선함,국민 눈높이 법률 개선!  이젠 더 쉽고 공정해요!
21,경찰법 전부개정법률안(대안),PRC_V2T0Q1O2E0U2Z1V8F4N4W1B1N4T1L2,2106259,자치경찰제 도입을 위한 법적 근거를 마련함,내 삶을 위한 안전한 변화! 자치경찰제 시대가 온다!
21,화학무기·생물무기의 금지와 특정화학물질·생물작용제 등의 제조·수출입 규제 등에 관한 법률 일부개정법률안(대안),PRC_F2Z2J0O1W0A5R1P3G1P2P0C6J8T2H2,2114347,신고 민원 처리절차를 명확히 규정하여 투명하고 신속한 처리를 추진함,"민원 신고, 투명하고 빠르게 처리!"
21,근로복지기본법 일부개정법률안,PRC_V2E1P0X1L2D7Y1P7B2S3Z2Z7Y2D6F0,2107818,플랫폼 노동자 휴게시설 설치 운영 및 비용 지원 근거를 신설함,"플랫폼 노동자, 쾌적한 휴식 보장!  휴게시설 지원 확대!"
21,규제자유특구 및 지역특화발전특구에 관한 규제특례법 일부개정법률안(대안),PRC_M2G3R1H1R2W8D1J6M3V3E3N5A7Z1O1,2126228,규제자유특구 신청 자격을 확대하고 운영을 개선함,"규제 팍팍 풀고, 특구 더 쉽게! 사업 활기 UP!"
21,도로법 일부개정법률안(대안),PRC_E2M3I0G6I2N7X1L4W5X4Q2Y3N0R5L7,2124200,도로 노선 지정 변경 및 폐지 절차를 개선하고 관광도로 지정 제도를 신설하며 도로 점용 시 보행자 안전 대책을 강화함,"편리하고 안전한 도로, 확실하게 바뀝니다!"
21,국민건강증진법 일부개정법률안(대안),PRC_K2A1T1O1H2V5S1D1G0C9W1N9E4G3Y2,2113637,시도 건강증진사업지원단 설치 근거 및 건강도시 조성 근거를 마련함,"건강도시 조성 지원 확대! 건강한 삶, 함께 만들어요!"
21,형사보상 및 명예회복에 관한 법률 일부개정법률안(대안),PRC_N2I3C1B2E1D8X1C7K2G7O4S7N2U5T6,2125987,형사보상 및 명예회복에 관한 법률 제26조를 개정하여 재심절차에서 원판결보다 가벼운 형으로 확정되어 초과 집행된 구금에 대한 보상 청구 근거를 마련함,"억울한 구금, 이젠 보상받으세요!"
21,중소기업기본법 일부개정법률안,PRC_L2Y2R0Y6P2Q0P0U9L3F8Q3B8J6I0O6,2116193,중소기업의 중견기업 진입 유예기간을 5년으로 연장함,"중소기업, 든든한 5년!  중견기업 도약 응원합니다!"
21,고용보험법 일부개정법률안(대안),PRC_M2L2O1R1P3M0T1O1U1T4W5M8H4Q7T4,2119183,고용보험법을 개선함,실업급여 더 빨리! 더 편하게!  받으세요!
21,사회서비스 지원 및 사회서비스원 설립·운영에 관한 법률안(대안),PRC_U2Q1D0K6G1I1A1L1T4Q1D3V9F5D8H7,2112219,사회서비스원 설립 및 운영 근거를 마련함,더 나은 사회복지 서비스! 사회서비스원이 온다!
21,여권법 일부개정법률안(대안),PRC_D2W3D0R4O1Q2I0W9Z5N1M5K4X3L7K0,2123302,여권 발급 및 관리체계를 강화함,빠르고 편리해진 여권 발급! 이젠 더욱 안전하게!
21,하천법 일부개정법률안(대안),PRC_T2C2D1U1Y3F0R0I9S2Z9A3F4T6H3X8,2118765,기후변화 대응 및 하천 관리 체계를 개선함,"깨끗한 하천, 쾌적한 미래! 기후변화 대응 강화!"
21,식품 등의 표시ㆍ광고에 관한 법률 일부개정법률안(대안),PRC_M2H3K0K2F1D6Y1J1J0M6W5C7B4L4L1,2122114,식품 등에 대한 시각청각장애인의 접근성을 보장하는 법적 근거를 신설함,시각·청각장애인도 식품 정보 쉽게! 👍
21,스토킹범죄의 처벌 등에 관한 법률 일부개정법률안(대안),PRC_Q2K3H0B6L1E9A2J0L4H3T0D0Y8N1A4,2122784,스토킹범죄 처벌 및 피해자 보호를 강화함,"스토킹 범죄, 더 강력하게 처벌! 피해자 안전 확보!"
21,지방자치분권 및 지역균형발전에 관한 특별법안(대안),PRC_H2F3G0T3H2W1Z1E4M5P7P4J1N6F9H2,2122280,지방자치분권 및 지역균형발전을 위한 법률을 통합하고 지방시대위원회를 신설하여 지역 주도의 발전체계를 구축함,지역이 살아나는 지방시대!  함께 만들어가요!
21,신용협동조합법 일부개정법률안,PRC_D2Z2K0O4P0Y1F1G1X1P6Q0E0D2R4Z5,2115469,신용협동조합의 비업무용 부동산 처분 규정을 법률에 명시함,"협동조합, 불필요 부동산 처분!  투명하게 운영!"
21,식품 등의 표시ㆍ광고에 관한 법률 일부개정법률안(대안),PRC_K2G1Z0X7E0I8A1X0V2E8H2G3X9Z0E0,2111692,소비기한 표시제를 도입하고 오인 가능한 식품 표시 광고를 금지함,소비기한 표시로 식품 안전 UP! 똑똑한 소비하세요!
21,긴급복지지원법 일부개정법률안,PRC_X2I2D0A7T1N8F1H1W0G9M5U8C7H1D4,2117304,긴급지원 기간을 3개월로 연장하고 연장 규정을 삭제함,"긴급 지원, 3개월 더!  걱정 덜고 힘내세요!"
21,건축물관리법 일부개정법률안(대안),PRC_O2Z1X1Z2P3W0K2B1R2T8O3H6R0L6I7,2114349,건축물 해체공사의 안전관리 체계를 강화함,"안전한 해체공사, 이제 걱정 끝!"
21,장애인 건강권 및 의료접근성 보장에 관한 법률 일부개정법률안,PRC_V2S1I0A1J2W1X0F9X3D8O2H3W6Q7V5,2107648,여성장애인 건강 증진을 위해 장애친화 산부인과 지정 근거를 마련함,여성 장애인 건강 지킴이! 장애친화 산부인과 확대!
21,사회복지사 등의 처우 및 지위 향상을 위한 법률 일부개정법률안,PRC_Z2K1X0C7S0X7E1C7K1P2M0B5H6C5H2,2112462,사회복지사 처우개선위원회를 신설함,사회복지사 처우 개선!  힘내세요!
21,국가첨단전략산업 경쟁력 강화 및 보호에 관한 특별조치법안(대안),PRC_E2J1E1Q2Q0V1Q1M7M5M5Z1Q2I8S1L6,2114346,국가첨단전략기술 및 국가첨단전략산업 육성을 위한 법적 근거를 마련함,첨단산업 육성으로 대한민국 미래가 밝아집니다!
21,인체조직안전 및 관리 등에 관한 법률 일부개정법률안,PRC_T2U2Y1A1G2P4A1R0A5E5U2B4K7I6Q1,2118813,국립조직기증관리기관 등의 가족관계등록사항 증명서 직접 교부 권한을 신설함,"가족관계증명서, 더 편하게 발급받으세요!"
21,노인복지법 일부개정법률안,PRC_G2G3F0D5E2C4D1K0L5K1K4I4J5I4P0,2122504,노인친화도시 지원 근거를 마련함,"어르신 행복, 더 가까이!  노인친화도시 지원 확대!"
21,고위공직자범죄수사처 설치 및 운영에 관한 법률 일부개정법률안(대안),PRC_A2D0L1O2E0O8Q1Y1B2U5J5D9C6H2T0,2106228,고위공직자범죄수사처 설립을 위한 관련 규정을 정비함,국민을 위한 공정한 수사! 고위공직자범죄수사처 설립!
21,기술보증기금법 일부개정법률안,PRC_Q2T0W0Q8D2J5H1B6K2Y2W2R0G3N8E1,2103270,기술보증기금의 연대보증채무 감경 또는 면제 기준을 신설함,연대보증 부담 덜어드려요!  기술보증기금 지원 확대!
21,아시아문화중심도시 조성에 관한 특별법 일부개정법률안,PRC_T2Q0A0E8F1R3O1E6Q1E7X5G1J1E9T0,2102954,국립아시아문화전당 운영체계를 일원화하고 관련 사업을 확대하여 아시아문화중심도시 조성사업을 추진함,"국립아시아문화전당, 확대 운영! 아시아 문화 꽃피네!"
21,제주4·3사건 진상규명 및 희생자 명예회복에 관한 특별법 일부개정법률안(대안),PRC_X2A1P1L1W2J5C1A4D0X0W2S0B7L4E9,2113799,제주43사건 희생자에 대한 보상 기준 및 절차를 명확히 규정함,"제주43 희생자, 보상절차 명확해져요!"
21,소방시설공사업법 일부개정법률안,PRC_G2K0J1F2B1F5S1C1J0I8C1P6C1N5G5,2106614,법률 용어를 한글화하여 국민의 법 이해도를 높임함,쉬운 법률 용어로 바뀌어 더욱 편리해졌어요!
21,정신건강증진 및 정신질환자 복지서비스 지원에 관한 법률 일부개정법률안(대안),PRC_R2V0H1Z1S2W5A1V1A1X6L3G2F9L5W8,2106065,국가트라우마센터 심리지원 대상 및 권역별 트라우마센터 설치 근거를 마련하고 무연고 정신질환자 사망 시 재산 처리 절차를 간소화함,"마음의 상처, 이젠 괜찮아요!  국가가 함께합니다!"
21,부패방지 및 국민권익위원회의 설치와 운영에 관한 법률 일부개정법률안(대안),PRC_W2U1K1G1I2U5A1U1I3X0I0Q3G0G1V5,2113773,부패행위 신고자 보호 및 보상 제도를 강화함,"부패 신고? 더 안전하게, 더 확실하게 보상받으세요!"
21,공무원 노동조합 관련 해직공무원등의 복직 등에 관한 특별법안(대안),PRC_F2Q0M1J1O2T6Y1M0Q0S7X2D4D8T8L2,2106264,공무원 노동조합 활동 관련 징계 또는 해직 처분을 받은 공무원의 복직 및 명예회복 절차를 마련함,"억울한 공무원, 다시 일터로! 명예 회복 지원!"
21,방문판매 등에 관한 법률 일부개정법률안,ARC_B2X0C0D7D1U0H1W4Z1W1X2Q8B5D4B3,2101773,신고 수리 여부를 10일 이내 통지하고 미통지시 수리한 것으로 간주하는 제도를 신설함,"신고 결과, 10일 내 알려드려요!"
21,주거기본법 일부개정법률안,PRC_O2G0H1S2D1C6V1N3F4X3K1A1H0L4X3,2106522,주거정책심의위원회 운영의 공정성과 투명성을 확보함,"주거 정책, 더 공정하고 투명하게!"
21,무인도서의 보전 및 관리에 관한 법률 일부개정법률안(대안),PRC_Y2F3A0P3F2J1Y1X4Y0C0K1F7Q1I0V1,2123481,무인도서 관리 규정을 정비하여 합리적인 보전 이용을 촉진함,"아름다운 무인도서, 이젠 더 안전하고 편리하게 누려요!"
21,국가초고성능컴퓨터 활용 및 육성에 관한 법률 일부개정법률안,PRC_Q2J1A0H7G0K7A1Z6M3H0F0S3H7T5W8,2111447,국가초고성능컴퓨팅위원회에 과학기술 전문가 임명을 신설함,"국가 초고성능 컴퓨팅, 전문가 손으로 더욱 발전!"
21,공익사업을 위한 토지 등의 취득 및 보상에 관한 법률 일부개정법률안(대안),PRC_Q2P1J1T2B3W0K2S1N3M1Q5H6Z6K1O9,2114331,대토보상 대상자 선정 기준을 강화하고 전매금지 위반자에 대한 제재를 강화함,"투기 방지!  깨끗한 대토보상, 약속드립니다!"
21,과학기술인공제회법 일부개정법률안,PRC_H2T0Y1A1Y1C0D1I1O2E5Y3B5J7C8S1,2105143,법률상 대차대조표 용어를 재무상태표로 변경함,재무상태표로 바뀌어 더 쉬워졌어요!
21,수입식품안전관리 특별법 일부개정법률안,PRC_P2P1Z0D5U2L8O0U9B5A7G4X1N8X0Q4,2110772,수입식품등 수입중단 해제 요건을 명확히 함,"수입 식품, 이젠 더 쉽게 만나요!"
21,노후계획도시 정비 및 지원에 관한 특별법안(대안),PRC_A2O3Z1D1S2A9I1L6S0C5N2Q3L2D3U6,2125837,노후 계획도시의 정비 및 재생을 위한 특별법을 제정함,"낡은 도시, 새롭게!  쾌적한 도시환경 조성!"
21,에너지산업융복합단지의 지정 및 육성에 관한 특별법 일부개정법률안,PRC_U2F1M0B5J2R0W1V1M0I4M3E3J0U4U6,2111005,전문연구기관 지정 취소 시 청문 절차를 신설함,"전문연구기관 지정 취소, 이제는 청문 절차 거쳐요!"
21,한국장학재단 설립 등에 관한 법률 일부개정법률안(대안),PRC_X2O1T1N1E2H4G1H6D1O5O1T0Z4J5M2,2113622,학자금 지원 대상에 학점은행제 학습자와 기존 학자금 대출자를 포함하여 지원 범위를 확대함,학자금 지원 범위 확대!  더 많은 분들이 혜택받으세요!
21,사회보장급여의 이용·제공 및 수급권자 발굴에 관한 법률 일부개정법률안,PRC_R2A2M1B2V2M2F1I3J3R8Q1R5C7R5J9,2119799,금융연체자 채무액 정보 활용을 신설함,"연체 정보 활용, 빚 걱정 덜어드려요!"
21,자유무역지역의 지정 및 운영에 관한 법률 일부개정법률안,PRC_M2K3G0H7F1G9E1F6D2E1L0K5K1J3K0,2123681,마산자유무역지역을 국가산업단지로 지정하는 특례규정을 신설함,"마산자유무역지역, 국가산단으로!  경제 활력 UP!"
21,식품·의약품 등의 안전기술 진흥법 전부개정법률안,PRC_A2S2X0S8U1R7H1Z7U3I7T0O7E5L4K2,2116985,식품의약품 등 안전 및 제품화 지원을 위한 규제과학혁신법을 제정함,"식품 안전, 규제혁신으로 더욱 안전하게!"
21,국회법 일부개정법률안(대안),PRC_C2T1L1F2I0A1J2L1O2S8K2Y6I6T6O5,2113800,전자투표 기기 고장 등의 사유 발생 시 거수표결 등 다른 표결 방식을 허용하고 원격영상회의 유효기간을 연장함,회의 효율 UP!  전자투표 기기 고장도 걱정 끝!
21,산림자원의 조성 및 관리에 관한 법률 일부개정법률안(대안),PRC_K2T2Y1S1Z1L7I1K3L1R7D2Y8Z8P7F8,2118772,산림사업 관리체계를 개선함,"산림 관리, 더욱 튼튼해졌어요!"
21,고독사 예방 및 관리에 관한 법률 일부개정법률안,PRC_B2Z3Y0G7H0G4D1K6K5E1D3B0C1O1N6,2123207,고독사 정의에서 시신 발견 시점을 삭제함,"고독사, 이젠 더 빨리 도울게요!"
21,지능형 로봇 개발 및 보급 촉진법 일부개정법률안,PRC_X2H2N0A8K1I2V0W9N2O2S1Z9F2B0C5,2116941,지능형 로봇 산업 육성을 위한 법률 개정안을 마련함,"첨단 로봇산업, 쑥쑥 커요!  미래 먹거리 확보!"
21,녹색건축물 조성 지원법 일부개정법률안(대안),PRC_C2C1E0G6Q1G6B1W7S4G9G5E3P0D7A7,2111161,공공건축물 에너지효율 개선 및 녹색건축 인증 관리를 강화함,쾌적하고 친환경적인 공공건축물로 변신!
21,동물보호법 전부개정법률안(대안),PRC_U2M1R1H2E0I2I1Q3Z1A4V4X1W0I6M1,2115073,동물보호법을 전부개정하여 동물학대 방지 및 동물복지 증진을 위한 제도를 강화함,동물학대 NO!  행복한 동물 세상 YES!
21,민사소송법 일부개정법률안(대안),PRC_Z2P0P1B1J1O7N2D3E0L8X4Z5R2X1J8,2105488,판결서 열람 및 검색 편의성을 높임함,"판결 정보, 이젠 쉽게 찾아봐요!"
21,노인 일자리 및 사회활동 지원에 관한 법률안(대안),PRC_Q2V3K0A2A1C6I1P1S0O4A5B6U3E7X2,2124623,노인 일자리 및 사회활동 지원을 위한 제도적 기반을 마련함,"어르신, 활기찬 삶 응원합니다! 더 많은 일자리 드려요!"
21,공항소음 방지 및 소음대책지역 지원에 관한 법률 일부개정법률안,PRC_G2Y0Z0C7K0U1J1H0W5B6W1L3J0S1K2,2101249,공항소음대책위원회의 의견청취 절차를 신설함,"소음 피해, 이젠 목소리 내세요! 공항소음 대책 강화!"
21,근로자직업능력 개발법 일부개정법률안(대안),PRC_P2F1X0M7Q0O8W1W6E5O7D5W0Q6R8J4,2111681,국민 평생 직업능력 개발 지원체계를 구축함,내 꿈을 향한 도전! 평생 직업능력 개발 지원!
21,출판문화산업 진흥법 일부개정법률안,PRC_B2T0Q1P1A0J3Y1Z5I5Q0D3M2X0A7S1,2104984,지역서점 활성화를 위한 법적 지원체계를 마련함,지역 서점 살리자!  든든한 지원으로 활짝!
21,지진·지진해일·화산의 관측 및 경보에 관한 법률 일부개정법률안,ARC_B2P0W0I6X2S6J1R6H2Q1W4Q4Y9F4M5,2101077,지진 지진해일 화산 관측 경보 연구개발사업 참여 기관 범위를 확대함,지진·화산·해일 감시 강화! 안전한 우리나라!
21,공무원직장협의회의 설립·운영에 관한 법률 일부개정법률안(대안),PRC_U2T2J0H1O0F5Z1G2O4K0H1O9T5E6J4,2115075,공무원직장협의회 운영을 활성화하고 협상력을 강화함,소통과 협력으로 더 나은 공직사회!
21,강원특별자치도 설치 등에 관한 특별법 일부개정법률안(대안),PRC_U2G2F0L9O2Z1V1B5U1V2S4F1E7M5O2,2117559,국무총리 소속 강원특별자치도 지원위원회를 신설함,"강원특별자치도, 든든한 지원 시작!"
21,정신건강증진 및 정신질환자 복지서비스 지원에 관한 법률 일부개정법률안(대안),PRC_A2F1H0X4P1W4F1X7B3Z6W0Z8Y9K3A9,2110274,정신질환 응급입원 및 조기치료 지원근거를 마련함,"정신질환 응급환자, 빠른 치료 지원으로 건강 UP!"
21,주차장법 일부개정법률안(대안),PRC_X2J3I0S4R1M8G1N6Y2V3A4G3W9Q2S7,2125812,승용차공동이용 활성화 및 무료 주차장 장기 주차 방지 법적 근거를 마련함,주차난 해소! 공유주차 확대!
21,농어업재해보험법 일부개정법률안(대안),PRC_Q2Y1A0N9U3V0U1X5R2G8A2A9W0N3G5,2113219,농어업재해보험 가입률 제고 및 보험료 산정 기준을 개선함,농어업 피해 걱정 끝! 보험 혜택 빵빵!
21,민법 일부개정법률안(대안),PRC_X2K2F1R2U0D6W2O0T3Z0Q5H4A6S3U8,2118749,민법에 만 나이 사용을 명확히 규정하여 나이 계산 관련 혼란을 해소함,"나이 계산, 이제 헷갈리지 마세요!  만 나이로 통일!"
21,지역보건법 일부개정법률안,PRC_J2Z3G0E1M1B0O1G6C2L1C0O8D6Z7E4,2119545,지역보건의료기관 협의회 신설을 통해 감염병 대응 및 지역보건의료사업 협력체계를 강화함,지역 의료 협력 강화! 감염병 걱정 뚝!
21,가맹사업거래의 공정화에 관한 법률 일부개정법률안(대안),PRC_P2N1T1M1X2L5G1S1G2W2E0P6W6Z0V3,2113763,가맹점사업자 권익 보호 및 가맹거래 질서 확립을 위해 관련 법규를 개선함,"가맹점 사장님, 이제 든든해요!  권익 보호 UP!"
21,경찰공무원법 일부개정법률안(대안),PRC_X2R3G0E3U2K1E1C5C0P0Q5H2I3H3O5,2123480,전사 순직 경찰공무원의 사망 전날 승진으로 인정하는 근거를 마련함,"순직 경찰, 마지막 날 승진! 명예와 예우를!"
21,대구경북과학기술원법 일부개정법률안,PRC_E2D1M1J1T0A2J1G7W3B7C2O5S2R4O1,2113141,대구경북과학기술원의 기술이전 사업화 및 창업지원 근거를 신설함,"대구경북 과학기술, 창업 지원 확대! 🚀"
21,지역보건법 일부개정법률안,PRC_Z2F1Z0H1P1M2Y1P3J4E6R2K8F9U4R0,2107577,지역보건의료서비스 제공을 위한 소득 재산 조사 시 일정 기준 이하인 경우 추가 조사를 생략하는 근거를 마련함,복지혜택 더 빨리! 소득조사 간소화!
21,사립학교법 일부개정법률안,PRC_U2T1L1D1J0P9I1Z4C3T3T5Y2T2L4L1,2113522,사립학교 교수의 사기죄 벌금 300만원 이상 형 확정 시 당연퇴직 규정을 신설함,"사립학교 교수 비리, 이제 당연퇴직!"
21,의료법 일부개정법률안(대안),PRC_O2T0A1E1C2G6M1K2V3E4C4U1E1W8M9,2106062,불법 의료행위 단속 및 의료 질서 확립을 위한 법적 근거를 마련함,건강한 의료 환경 조성! 불법 의료행위 OUT!
21,재난 및 안전관리 기본법 일부개정법률안(대안),PRC_L2Q3A0C2S2X3P1A9S3A6M3V2M1X4Q7,2121674,재난 피해 지원 대상에 소상공인을 포함하고 재난안전데이터 관리체계를 구축하여 재난 대응 역량을 강화함,소상공인 재난지원 확대! 안전한 대한민국!
21,달빛고속철도 건설을 위한 특별법안,PRC_H2Z3S0A8E2G2Q1W5F1Q8C4G7V6F9K8,2123938,달빛고속철도 건설을 위한 법적 근거를 마련함,"달빛고속철도, 꿈이 현실로!  빠르고 편리하게!"
21,개인정보 보호법 일부개정법률안(대안),PRC_M2G2Z1U1I2C3V1E3N4W8K5I4J2L5W6,2120089,개인정보 보호 관련 법규를 개선함,"내 정보, 더 안전하게! 개인정보 보호 강화!"
21,도시교통정비 촉진법 일부개정법률안,PRC_L2Q0W0B7Y2B1D1F5U0S2L5L3L5R0H1,2102238,도시교통정비 기본계획에 온실가스 감축 등 환경친화적 요소를 추가함,도시가 더 깨끗해져요! 친환경 교통으로 미래를 향해!
21,독립유공자예우에 관한 법률 일부개정법률안(대안),PRC_Z2K3G1U1N2M9A1S9C5G8W4J1I7K8V0,2126393,담당 공무원의 생활조정수당 대리 신청 및 관련 자료 요청을 가능하게 하여 독립유공자 지원을 강화함,독립유공자 지원 더욱 강화! 간편 신청으로 편리하게!
21,국방개혁에 관한 법률 일부개정법률안,PRC_A2A0K1E2K1H5T0S9R3B6G1M0J3V1T0,2106612,법률 용어를 한글화하여 국민의 법 이해도를 높임함,쉬운 법률 용어로 바꿔드려요! 이제 법이 더 쉽게 다가와요!
21,자연공원법 일부개정법률안,ARC_W2S0D0I7U1M7R1T8X4Y7U3Z1D9E0E3,2102162,공원 행위신고 및 시설 사용료 허가 절차를 명확히 규정하고 처리 기간을 준수하도록 개선함,공원 이용 더 편리해졌어요! 신고·허가 절차 간편하게!
21,항만안전특별법안(대안),PRC_U2Z1E0F6D2L3H0U9J4U6R3V0A3Y9C0,2111675,항만 안전 관리 체계를 강화함,항만 안전 확실하게! 더욱 안전한 바다를 만들어요!
21,주한미군기지 이전에 따른 평택시 등의 지원 등에 관한 특별법 일부개정법률안,PRC_C2E0O1V1U1F9D1N4R5V2E4X5Y1V4J5,2105548,주한미군 평택 이전 지원 및 지역개발 사업의 유효기간을 연장하고 지원 규정을 정비함,"평택, 더 발전합니다! 주한미군 이전 지원 연장!"
21,철도사업법 일부개정법률안,PRC_K2D0Q1A2X1Z5E1A7X4D0Q3L2Z0B2G6,2106667,법률 용어를 한글화하여 국민의 법 이해도를 높임함,쉬운 법률 용어로 바꿔드려요! 이제 법이 더 쉽게 다가와요!
21,교육환경 보호에 관한 법률 일부개정법률안(대안),PRC_F2N1M0T8T1U8W1Z9X2E5I0G5W4C0O6,2112209,교육환경보호위원회 위원 연임 제한을 한 차례로 제한하고 교육환경보호구역 관련 규제를 개선함,쾌적한 교육환경 조성!  규제 완화로 더 나은 미래!
21,수의사법 일부개정법률안,PRC_G2W0K0C9B2L8X1Z4A0V6N4M6O1G5X1,2104293,수의사 면허 효력 정지 사유에 품위 손상 행위를 추가함,"수의사 품위 손상, 면허 정지! 동물복지 강화!"
21,공항소음 방지 및 소음대책지역 지원에 관한 법률 일부개정법률안(대안),PRC_I2C3H0T2P1C4C1X4P0Z2F5H2S9Z9B3,2120941,소음대책지역 지정 사실을 주민에게 통지하고 소음부담금 가산금 부과 체계를 개선함,"소음피해 NO! 주민에게 먼저 알리고, 부담금도 꼼꼼하게 개선!"
21,건설폐기물의 재활용촉진에 관한 법률 일부개정법률안(대안),PRC_Y2Q2Z0J5A1M1F1I3H0U5W5Y7P3V2U5,2120243,건설폐기물 처리 관련 과징금 제도를 개선하고 신고 수리 간주 제도를 신설함,"건설폐기물 처리, 더 쉽고 투명하게! 과징금 제도 개선!"
21,지방공무원 교육훈련법 일부개정법률안(대안),PRC_J2K1S0X9P0K2L1S7X5V0N4U3N2Z7V9,2112683,지방의회의 인력운영 자율성과 책임성을 강화함,"지방의회, 더 효율적으로! 시민을 위해 달립니다!"
21,중소기업 사업전환 촉진에 관한 특별법 일부개정법률안,PRC_R2Q3Q0O5P3O0O1W1W2V7T2U7S0S2B8,2122631,중소기업사업전환지원센터 지정 제도를 강화함,"중소기업, 든든한 지원 센터 확대!"
21,혁신도시 조성 및 발전에 관한 특별법 일부개정법률안,PRC_B2L0E1B1F0G3F1H0I0K1U5T9H0L9G4,2104869,혁신도시 발전지원센터의 사업 범위를 확대하고 지식산업센터 관리 업무 위탁 근거를 마련함,혁신도시 더 발전! 센터 사업 확대!
